"folder","name","type","documentation","id","ggm-guid","ggm-uml-type","ggm-datum-tijd-export","Let op","Object ID","GEMMA URL","synoniemen","alternate name","bron","Meer specifiek"
"/Business/_Sync GEMMA en project/GGM/Bedrijfsobjecten/","Activa","business-object","Bezittingen van een onderneming op een boekhoudkundige balans","id-3861e3def6e946a59ef7c258310b5b4f","{7B8D0A8F-07BF-42bf-90B3-28A72BD4401A}","Class","06112023-07:59:13","""ggm-"" properties worden beheerd in het GGM informatiemodel","e83e86ad-4769-41ce-91c7-675e93441074","https://redactie.gemmaonline.nl/index.php/GEMMA2/0.9/id-6f15e2ca-531d-4879-b087-f43559d8c3fd",,,,
"/Business/_Sync GEMMA en project/GGM/Bedrijfsobjecten/","VERBLIJFSTITEL","business-object","Rechtsgrond op basis waarvan men bevoegd is in een land te verblijven.
Opmerkingen obv Key2Burgerzaken:
De verblijfstitel heeft een ingangs- en vervaldatum, datum geldig en een opname datum
RSGB3.0 onderkent alleen Datum einde en Datum ingang. Dat is onvoldoende om volgorde en geldigheid in tijd correct te bepalen","id-387b4663c48549f08f53a131d60efb22","{A660422D-E9ED-47c9-9978-480E57572775}","Class","06112023-07:59:13","""ggm-"" properties worden beheerd in het GGM informatiemodel","fd0e38fd-ce78-454e-9d27-268a9e15ca40","https://redactie.gemmaonline.nl/index.php/GEMMA2/0.9/id-6f15e2ca-531d-4879-b087-f43559d8c3fd",,,,
"/Business/_Sync GEMMA en project/GGM/Bedrijfsobjecten/","Verlof","business-object","Een periode waarin iemand toestemming heeft om iets te doen, in het bijzonder om afwezig te zijn.","id-38d76073fc0946188750967204e3a065","{D04135BF-C2F0-46dd-B332-F1BE36C358EF}","Class","06112023-07:59:13","""ggm-"" properties worden beheerd in het GGM informatiemodel","9ba143bc-5214-4998-9041-b3dc1c22fe77","https://redactie.gemmaonline.nl/index.php/GEMMA2/0.9/id-6f15e2ca-531d-4879-b087-f43559d8c3fd",,,,
"/Business/_Sync GEMMA en project/GGM/Bedrijfsobjecten/","Rechthebbende","business-object","Een rechthebbende is iemand die rechten heeft op een goed.","id-3941e02c5e8a44b68121b1ad3f5102ef","{9AE5BCE3-AD6D-4241-9651-823400E3745F}","Class","06112023-07:59:13","""ggm-"" properties worden beheerd in het GGM informatiemodel","be17bc1c-f653-4b92-8f97-9e9219502be5","https://redactie.gemmaonline.nl/index.php/GEMMA2/0.9/id-6f15e2ca-531d-4879-b087-f43559d8c3fd",,,,
"/Business/_Sync GEMMA en project/GGM/Bedrijfsobjecten/","Balieafspraak","business-object","Balieafspraken zijn afspraken voor een klantcontact. Dit ongeacht of deze werkelijk heeft plaatsgevonden of gaat plaatsvinden, soms liggen deze in de toekomst of is iemand niet op komen dagen, of iets anders waardoor het klantcontact nog niet heeft plaatsgevonden.","id-3945742e03c246af80f1e0b03d196a35","{631FEEF1-88D3-4d18-ADB2-BF999068493E}","Class","06112023-07:59:13","""ggm-"" properties worden beheerd in het GGM informatiemodel","8fd2ff34-a208-4924-bec3-b5ee7e5e7a18","https://redactie.gemmaonline.nl/index.php/GEMMA2/0.9/id-6f15e2ca-531d-4879-b087-f43559d8c3fd",,,,
"/Business/_Sync GEMMA en project/GGM/Bedrijfsobjecten/","NUMMERAANDUIDING","business-object","Een nummeraanduiding is een door het bevoegde gemeentelijke orgaan als zodanig toegekende aanduiding van een verblijfsobject, een standplaats of een ligplaats. Het is het samenstel van postcode, huisnummer, huisletter en huisnummertoevoeging.","id-39aa2208800c4a00bcbb39ed00d088c8","{32A22BC6-89EC-44af-8D7D-79B12311AE2D}","Class","06112023-07:59:13","""ggm-"" properties worden beheerd in het GGM informatiemodel","f152bdf8-bd60-4c88-b739-e3091afdbf7a","https://redactie.gemmaonline.nl/index.php/GEMMA2/0.9/id-6f15e2ca-531d-4879-b087-f43559d8c3fd",,"NUMMERAANDUIDING (BAG)","Door KING toegevoegd objecttype (maakt geen deel uit van enige basisregistratie).",
"/Business/_Sync GEMMA en project/GGM/Bedrijfsobjecten/","Beperkingscore","business-object","Getalsmatige duiding van een beperking","id-3b81c14377b045e2a260b53caddaf4ff","{5EDE0349-8865-4b90-9A18-235C5AA660C4}","Class","06112023-07:59:13","""ggm-"" properties worden beheerd in het GGM informatiemodel","8d15d21d-4e39-4dcb-b9f7-be128f6b324a","https://redactie.gemmaonline.nl/index.php/GEMMA2/0.9/id-6f15e2ca-531d-4879-b087-f43559d8c3fd",,,,
"/Business/_Sync GEMMA en project/GGM/Bedrijfsobjecten/","Initiatiefnemer","business-object","Een Natuurlijk Persoon of een Niet Natuurlijk Persoon die het initiatief neemt tot (fysieke) ingrepen in de (leef)omgeving en daartoe een Verzoek bij het Bevoegd Gezag indient. (IMAM)","id-3b826e0e4d9541f2bc25f6e64ad796ce","{E38BEAEF-03C4-439b-8A64-663886C1D6F9}","Class","06112023-07:59:13","""ggm-"" properties worden beheerd in het GGM informatiemodel","fe2e2e4e-228a-46d7-964f-a489ed253d2d","https://redactie.gemmaonline.nl/index.php/GEMMA2/0.9/id-6f15e2ca-531d-4879-b087-f43559d8c3fd",,,,
"/Business/_Sync GEMMA en project/GGM/Bedrijfsobjecten/","Juridische Regel","business-object","De beschrijving van een regel met juridische werkingskracht. Een regel betreft binnen de Omgevingswet veelal activiteiten, en/of normen en/of functies en/of beperkingengebieden.","id-3bfec8f1fcd843d0867bdb135e40b881","{DDFF98D8-99FF-47b5-82D1-7FF2376750D6}","Class","06112023-07:59:13","""ggm-"" properties worden beheerd in het GGM informatiemodel","6f20ada6-28e9-4358-9b66-1575021ee431","https://redactie.gemmaonline.nl/index.php/GEMMA2/0.9/id-6f15e2ca-531d-4879-b087-f43559d8c3fd",,,,"Omgevingswaarderegel, Regel voor Iedereen, Instructieregel"
"/Business/_Sync GEMMA en project/GGM/Bedrijfsobjecten/","Vacature","business-object","Een arbeidsplaats binnen een bedrijf of organisatie die nog gevuld dient te worden door werkzoekenden.","id-3c763146e1cb40ad901cae54c00502bb","{DC978807-5F36-4148-B816-D6886D026DD8}","Class","06112023-07:59:13","""ggm-"" properties worden beheerd in het GGM informatiemodel","bd6c1561-9387-409b-a16b-99e79492ad3d","https://redactie.gemmaonline.nl/index.php/GEMMA2/0.9/id-6f15e2ca-531d-4879-b087-f43559d8c3fd",,,,
"/Business/_Sync GEMMA en project/GGM/Bedrijfsobjecten/","BENOEMD TERREIN","business-object","Een STANDPLAATS, LIGPLAATS, of een OVERIG BENOEMD TERREIN.","id-3c7e805726be423a90f6b483380ebe71","{73F1C4A1-481E-4052-A372-1A0895ED1295}","Class","06112023-07:59:13","""ggm-"" properties worden beheerd in het GGM informatiemodel","c0361a4b-968e-477e-b81c-ee26a5aa0543","https://redactie.gemmaonline.nl/index.php/GEMMA2/0.9/id-6f15e2ca-531d-4879-b087-f43559d8c3fd",,,"Door KING toegevoegd objecttype (maakt geen deel uit van enige basisregistratie).","OVERIG BENOEMD TERREIN, STANDPLAATS, LIGPLAATS"
"/Business/_Sync GEMMA en project/GGM/Bedrijfsobjecten/","Telefoniegegevens","business-object","Gegevens die worden bewaard van telefoongesprekken","id-3d1d6e5209df4805813173ae2d769868","{DDD2167F-4A0F-468b-894E-6BB9ED9DA5E0}","Class","06112023-07:59:13","""ggm-"" properties worden beheerd in het GGM informatiemodel","e63e4e3c-ca45-4690-aa55-c38a1bc73d2c","https://redactie.gemmaonline.nl/index.php/GEMMA2/0.9/id-6f15e2ca-531d-4879-b087-f43559d8c3fd",,,,
"/Business/_Sync GEMMA en project/GGM/Bedrijfsobjecten/","Geo-Object","business-object","Abstractie van een fenomeen in de werkelijkheid, dat direct of indirect is geassocieerd met een locatie relatief ten opzichte van de aarde. [NEN 3610:2011]","id-3d37f3247d0c48178e409d6d138c7fbf","{05B355EF-39EA-4bfb-B1F3-AB31841C986E}","Class","06112023-07:59:13","""ggm-"" properties worden beheerd in het GGM informatiemodel","f5de1e41-5207-4d9e-a4f8-7889b5c1e2b1","https://redactie.gemmaonline.nl/index.php/GEMMA2/0.9/id-6f15e2ca-531d-4879-b087-f43559d8c3fd",,,,"SPOOR, SCHEIDING, OVERIG BOUWWERK, OVERIG BENOEMD TERREIN, KUNSTWERKDEEL, FUNCTIONEEL GEBIED, PAND, WEGDEEL, WATERDEEL, VEGETATIEOBJECT, TUNNELDEEL, OVERIGE SCHEIDING, OVERBRUGGINGSDEEL, ONDERSTEUNEND WEGDEEL, ONDERSTEUNEND WATERDEEL, ONBEGROEID TERREINDEEL, INRICHTINGSELEMENT, GEBOUWINSTALLATIE, BEGROEID TERREINDEEL"
"/Business/_Sync GEMMA en project/GGM/Bedrijfsobjecten/","VOMAanvraagOfMelding","business-object","VOM staat voor Vergunning, Ontheffing of Melding. Het betreft hier een melding of een aanvraag voor een vergunning of een ontheffing.","id-3d688b90c3324147a987db8e7b2a0cbd","{44B26957-BAA4-41c2-ABBF-CC1AC91D30D6}","Class","06112023-07:59:13","""ggm-"" properties worden beheerd in het GGM informatiemodel","f10ba880-2051-4fd8-8495-f34f1a617dc0","https://redactie.gemmaonline.nl/index.php/GEMMA2/0.9/id-6f15e2ca-531d-4879-b087-f43559d8c3fd",,,,"WABOAanvraagOfMelding, VTHAanvraagOfMelding"
"/Business/_Sync GEMMA en project/GGM/Bedrijfsobjecten/","Beschikking","business-object","In het bestuursrecht: Een beslissing van een overheidsorgaan in een concreet geval, bijvoorbeeld het verlenen van een bouwvergunning. In het civiele recht: een rechterlijke uitspraak in een procedure die begint met een verzoekschrift.","id-3d9b45d27b6840b39b99e8ede85db6f4","{71D7E96D-641A-4b6a-A325-DED07C3B5836}","Class","06112023-07:59:13","""ggm-"" properties worden beheerd in het GGM informatiemodel","c481e8b8-f7d7-4979-b767-ebf2a9b04712","https://redactie.gemmaonline.nl/index.php/GEMMA2/0.9/id-6f15e2ca-531d-4879-b087-f43559d8c3fd",,,,
"/Business/_Sync GEMMA en project/GGM/Bedrijfsobjecten/","SociaalTeamDossier","business-object","","id-3dcacd1c3bce4b8e8a8a12400232f204","{A22B8038-3C04-44a7-8E75-90A3A5E2615B}","Class","06112023-07:59:13","""ggm-"" properties worden beheerd in het GGM informatiemodel","276088a8-7dcf-4dd8-9450-bf677c7329ed","https://redactie.gemmaonline.nl/index.php/GEMMA2/0.9/id-6f15e2ca-531d-4879-b087-f43559d8c3fd",,,,
"/Business/_Sync GEMMA en project/GGM/Bedrijfsobjecten/","KADASTRALE GEMEENTE","business-object","De mogelijke onderscheiden gedeeltes van het grondgebied van Nederland, volgens de Dienst Kadaster en de Openbare Registers, zoals nader omschreven in het Kadasterbesluit","id-4043bb8a5d6447358f7112cb89f523c1","{51BA37A4-2E1D-4704-9153-02759084D5E2}","Class","06112023-07:59:13","""ggm-"" properties worden beheerd in het GGM informatiemodel","c7c60998-7075-40c7-b9d0-14febabaad96","https://redactie.gemmaonline.nl/index.php/GEMMA2/0.9/id-6f15e2ca-531d-4879-b087-f43559d8c3fd",,,"BRK",
"/Business/_Sync GEMMA en project/GGM/Bedrijfsobjecten/","Indieningsvereisten","business-object","Dat wat de initiatiefnemer moet aanleveren om het bevoegd gezag een aanvraag te kunnen laten beoordelen. De indieningsvereisten is de set aan informatie (gegevens en / of bijlagen) die aan een aanvraag moet worden toegevoegd voor een bepaalde vergunning of melding.","id-40470189c97f4425ab43018fa74edd77","{8587D910-7A9C-46d8-BF27-27433E9B6DAD}","Class","06112023-07:59:13","""ggm-"" properties worden beheerd in het GGM informatiemodel","c92e9c16-1ec3-46f8-b209-b15a226e9477","https://redactie.gemmaonline.nl/index.php/GEMMA2/0.9/id-6f15e2ca-531d-4879-b087-f43559d8c3fd",,,,
"/Business/_Sync GEMMA en project/GGM/Bedrijfsobjecten/","GEMEENTE","business-object","Een gedeelte van het grondgebied van Nederland, ingesteld op basis van artikel 123 van de Grondwet.","id-40d40c07304c4594983b9cf8048f746d","{EA6F820F-C458-4b24-8055-5C2CC76F5904}","Class","06112023-07:59:13","""ggm-"" properties worden beheerd in het GGM informatiemodel","f830bbc9-38d5-4f61-be23-79091f18282e","https://redactie.gemmaonline.nl/index.php/GEMMA2/0.9/id-6f15e2ca-531d-4879-b087-f43559d8c3fd",,"GEMEENTE (BAG)","Door KING toegevoegd objecttype,ontleend aan het GFO BG (maakt geen deel uit van enige basisregistratie).",
"/Business/_Sync GEMMA en project/GGM/Bedrijfsobjecten/","Subsidieprogramma","business-object","Programma waarin meerdere subsidies worden verleend vanuit een bepaalde samenhang","id-43fad73a0d5b456da9c3cfabd294f6fe","{8F1A719D-C89A-4194-8FF4-1F3E0F174D3D}","Class","06112023-07:59:13","""ggm-"" properties worden beheerd in het GGM informatiemodel","3c8f512f-33ab-4e24-8ea4-820796359003","https://redactie.gemmaonline.nl/index.php/GEMMA2/0.9/id-6f15e2ca-531d-4879-b087-f43559d8c3fd",,,,
"/Business/_Sync GEMMA en project/GGM/Bedrijfsobjecten/","CMDB-item","business-object","Item in een Configuratie Management DataBase","id-449678c051be48e386f62cce1b25a0ec","{B027D022-41D9-4c63-A63D-8F5111689564}","Class","06112023-07:59:13","""ggm-"" properties worden beheerd in het GGM informatiemodel","f5365fcc-279e-42e5-bde4-e7b10700a8ed","https://redactie.gemmaonline.nl/index.php/GEMMA2/0.9/id-6f15e2ca-531d-4879-b087-f43559d8c3fd",,,,"Linkbaar CMDB-item, Vervoersmiddel, Toegangsmiddel, Software, Nertwerkcomponent, Licentie, Inventaris, Hardware"
"/Business/_Sync GEMMA en project/GGM/Bedrijfsobjecten/","Leverancier","business-object","Een niet-natuurlijk persoon die een product of dienst levert aan de organisatie","id-44fbb5ef64e44ae08aa1838c4908cded","{EA7FE08E-34F7-45d2-BE2E-E4E3B8333BF3}","Class","06112023-07:59:13","""ggm-"" properties worden beheerd in het GGM informatiemodel","113af80a-7e3e-41f6-8f79-8d0d48c4c257","https://redactie.gemmaonline.nl/index.php/GEMMA2/0.9/id-6f15e2ca-531d-4879-b087-f43559d8c3fd",,,,"Uitvoerder Graafwerkzaamheden, Vervoerder, Belprovider"
"/Business/_Sync GEMMA en project/GGM/Bedrijfsobjecten/","Batch","business-object","Verzameling van posten die in het kader van automatische verwerking een logisch geheel vormen.","id-4511fb75bd3542158b7e7962416ed2d9","{A784A0ED-4451-4a92-B7C8-ABE528BA898F}","Class","06112023-07:59:13","""ggm-"" properties worden beheerd in het GGM informatiemodel","4499a4ec-1e22-4a1c-968a-ad3dbb7be6a1","https://redactie.gemmaonline.nl/index.php/GEMMA2/0.9/id-6f15e2ca-531d-4879-b087-f43559d8c3fd",,,,
"/Business/_Sync GEMMA en project/GGM/Bedrijfsobjecten/","Pas","business-object","","id-456971d00e92423bad852458db9a8074","{F6D7A83B-30BC-44f4-91E2-74C04DCE87AE}","Class","06112023-07:59:13","""ggm-"" properties worden beheerd in het GGM informatiemodel","4f840a95-77ba-47ae-b554-a00db6f905b4","https://redactie.gemmaonline.nl/index.php/GEMMA2/0.9/id-6f15e2ca-531d-4879-b087-f43559d8c3fd",,,,
"/Business/_Sync GEMMA en project/GGM/Bedrijfsobjecten/","VESTIGING","business-object","Een gebouw of complex van gebouwen waar duurzame uitoefening van de activiteiten van een onderneming of rechtspersoon plaatsvindt.","id-461bd1f66b904d5898fd8f8d3579c0d4","{B60B8EF9-D1C0-4e36-BF9B-1C16F92518DD}","Class","06112023-07:59:13","""ggm-"" properties worden beheerd in het GGM informatiemodel","b403d1ab-a0ee-4ca0-befa-01bbc54bf403","https://redactie.gemmaonline.nl/index.php/GEMMA2/0.9/id-6f15e2ca-531d-4879-b087-f43559d8c3fd",,,"NHR","Hotel, Verkooppunt"
"/Business/_Sync GEMMA en project/GGM/Bedrijfsobjecten/","Installatie","business-object","Samenhangend systeem dat een bepaald doel dient.","id-462495ea16a348a7bd08dbfc23475f79","{A143A97F-28C5-4B56-90F8-4773481A034}","Class","06112023-07:59:13","""ggm-"" properties worden beheerd in het GGM informatiemodel","d5b79e05-a743-4c1f-8a37-5e6911701aab","https://redactie.gemmaonline.nl/index.php/GEMMA2/0.9/id-6f15e2ca-531d-4879-b087-f43559d8c3fd",,,,"Pomp"
"/Business/_Sync GEMMA en project/GGM/Bedrijfsobjecten/","Sportlocatie","business-object","Locatie waar de betreffende sport plaatsvindt","id-46b53c1a72dc43dbbef0c3bee8ebc188","{BE5E10D0-FD83-4b0a-B5D2-4A7EE6B9C53B}","Class","06112023-07:59:13","""ggm-"" properties worden beheerd in het GGM informatiemodel","a7a350a2-a9aa-4437-b67b-016fec0d048d","https://redactie.gemmaonline.nl/index.php/GEMMA2/0.9/id-6f15e2ca-531d-4879-b087-f43559d8c3fd",,,,"Sportpark, Binnenlocatie"
"/Business/_Sync GEMMA en project/GGM/Bedrijfsobjecten/","Naheffing","business-object","Het achteraf vorderen van te weinig betaalde belasting","id-472ed9d4d68944929e2889daafbf4665","{4957AC99-3F36-4959-A210-9EC6759B87F8}","Class","06112023-07:59:13","""ggm-"" properties worden beheerd in het GGM informatiemodel","d10d2101-2e16-4f56-bcce-43783fd256be","https://redactie.gemmaonline.nl/index.php/GEMMA2/0.9/id-6f15e2ca-531d-4879-b087-f43559d8c3fd","Navordering",,,
"/Business/_Sync GEMMA en project/GGM/Bedrijfsobjecten/","VTHzaak","business-object","","id-48cf79a0e97e481dad0e5effc35ef9e9","{88AF7A2E-C508-464a-AD22-DD9B156D570D}","Class","06112023-07:59:13","""ggm-"" properties worden beheerd in het GGM informatiemodel","0080f5e8-d0d2-4a34-816d-24c8ec6b185a","https://redactie.gemmaonline.nl/index.php/GEMMA2/0.9/id-6f15e2ca-531d-4879-b087-f43559d8c3fd",,,,
"/Business/_Sync GEMMA en project/GGM/Bedrijfsobjecten/","WOONPLAATS","business-object","Definitie
Een woonplaats is een door het bevoegde gemeentelijke orgaan als zodanig aangewezen en van een naam voorzien gedeelte van het grondgebied van de gemeente

Beschrijving
Een stuk grond binnen de gemeente dat als woonplaats is aangewezen en waaraan de gemeente ook een naam heeft gegeven.","id-495e6a64f8004b0bae222e4f3a6c0ea4","{24BDA4BA-CFCC-4e3f-8305-671F4ED7C502}","Class","06112023-07:59:13","""ggm-"" properties worden beheerd in het GGM informatiemodel","bedf86fb-8710-49fc-addb-e48a11b551ed","https://redactie.gemmaonline.nl/index.php/GEMMA2/0.9/id-6f15e2ca-531d-4879-b087-f43559d8c3fd",,"WOONPLAATS (BAG)","BAG",
"/Business/_Sync GEMMA en project/GGM/Bedrijfsobjecten/","Inspectie","business-object","het inwinnen, verwerken en interpreteren van informatie met het doel om de momentane toestand van de boezemkade vast te stellen.","id-4a6c7c11248546bda43a288253ed907e","{F73901FC-A78E-486f-B6C6-74CFCBE26CAB}","Class","06112023-07:59:13","""ggm-"" properties worden beheerd in het GGM informatiemodel","8922cc29-6d1c-4a9c-abd6-6a53dda41cdf","https://redactie.gemmaonline.nl/index.php/GEMMA2/0.9/id-6f15e2ca-531d-4879-b087-f43559d8c3fd",,,,
"/Business/_Sync GEMMA en project/GGM/Bedrijfsobjecten/","Melding","business-object","De betekenisvolle formulering van een waargenomen feit, waaraan een waarde kan worden toegekend","id-4ba5650ca2bc4760b547a21173d4f703","{C6094F79-D8EA-4763-90DF-4E30EFABA1FA}","Class","06112023-07:59:13","""ggm-"" properties worden beheerd in het GGM informatiemodel","1a89112a-e13c-4c87-a862-e8ec66c01588","https://redactie.gemmaonline.nl/index.php/GEMMA2/0.9/id-6f15e2ca-531d-4879-b087-f43559d8c3fd",,"Melding (Beheer Openbare Ruimte)",,"CROW-Melding, Storing, MeldingOngeval, Inspectie, Actie"
"/Business/_Sync GEMMA en project/GGM/Bedrijfsobjecten/","Verkooppunt","business-object","Locatie waar iets wordt verkocht","id-4bd05140a4f74503b06be0d1d0be5646","{8F05E7BA-E7ED-45d1-9626-C8D7FBDB2F1B}","Class","06112023-07:59:13","""ggm-"" properties worden beheerd in het GGM informatiemodel","9f1dd63c-3407-460d-aef7-56cb6c3c20ad","https://redactie.gemmaonline.nl/index.php/GEMMA2/0.9/id-6f15e2ca-531d-4879-b087-f43559d8c3fd",,,,
"/Business/_Sync GEMMA en project/GGM/Bedrijfsobjecten/","Artefact","business-object","De benaming voor ieder verplaatsbaar object dat door de mens is vervaardigd, bewerkt en/of gebruikt.","id-4c062f414bde4a34901fbc07fb38d253","{2C230EE7-036D-48be-B82A-FF45598170F7}","Class","06112023-07:59:13","""ggm-"" properties worden beheerd in het GGM informatiemodel","7f936c4f-360e-47a3-a558-1682d8cfbf1a","https://redactie.gemmaonline.nl/index.php/GEMMA2/0.9/id-6f15e2ca-531d-4879-b087-f43559d8c3fd","artefacten, voorwerp, voorwerpen",,,
"/Business/_Sync GEMMA en project/GGM/Bedrijfsobjecten/","Maatregelen","business-object","Beschrijft welke handelingen iemand moet uitvoeren om aan Voorschriften te kunnen voldoen.","id-4c37039b25d2472d9b2edaa135fc414d","{45591365-C55F-4735-9533-D3BBB0AB6571}","Class","06112023-07:59:13","""ggm-"" properties worden beheerd in het GGM informatiemodel","c87f39a5-c4b4-4c82-bf23-f9fc521ad0aa","https://redactie.gemmaonline.nl/index.php/GEMMA2/0.9/id-6f15e2ca-531d-4879-b087-f43559d8c3fd",,,,
"/Business/_Sync GEMMA en project/GGM/Bedrijfsobjecten/","Voertuig","business-object","Vervoermiddel bestemd voor het verkeer over wegen","id-4c3b88438e6647de839ed692d4d6bb80","{6AD98160-FFE6-4105-A724-5D5733C87CD8}","Class","06112023-07:59:13","""ggm-"" properties worden beheerd in het GGM informatiemodel","b083bd60-0137-40b0-ad72-4602b3c1d754","https://redactie.gemmaonline.nl/index.php/GEMMA2/0.9/id-6f15e2ca-531d-4879-b087-f43559d8c3fd",,,,
"/Business/_Sync GEMMA en project/GGM/Bedrijfsobjecten/","Milieustraat","business-object","Een locatie die specifiek bestemd is voor het brengen van gescheiden huishoudelijk afval en grofvuil.","id-4c5fd81e15cc4d6ba7c9084770c53649","{1638F2AF-F1E8-4360-BA47-D975F2135168}","Class","06112023-07:59:13","""ggm-"" properties worden beheerd in het GGM informatiemodel","0310645e-6873-4cb3-93ec-734f0ac3323e","https://redactie.gemmaonline.nl/index.php/GEMMA2/0.9/id-6f15e2ca-531d-4879-b087-f43559d8c3fd",,,,
"/Business/_Sync GEMMA en project/GGM/Bedrijfsobjecten/","Aanvraag","business-object","(officieel) verzoek, iets (officieel) vragen aan een bevoegde macht.","id-4c995e53fd534fb1895e557ad513c729","{2F2A3590-9B34-4ec5-B0AE-B487ED241155}","Class","06112023-07:59:13","""ggm-"" properties worden beheerd in het GGM informatiemodel","6c992a39-ca0b-4d4c-b749-fe8167af540d","https://redactie.gemmaonline.nl/index.php/GEMMA2/0.9/id-6f15e2ca-531d-4879-b087-f43559d8c3fd",,"Aanvraag (Archief)",,
"/Business/_Sync GEMMA en project/GGM/Bedrijfsobjecten/","Beheerobject","business-object","Verzamelobject - niveau 1","id-4ccfcee33ebc4b81bc987ab55674027f","{E060DC30-E4F2-4794-A16E-7207032E250}","Class","06112023-07:59:13","""ggm-"" properties worden beheerd in het GGM informatiemodel","7866576d-8cb5-495b-a2f4-2b56393ee7b5","https://redactie.gemmaonline.nl/index.php/GEMMA2/0.9/id-6f15e2ca-531d-4879-b087-f43559d8c3fd",,,,"Sensor, Weginrichtingsobject, Waterobject, Waterinrichtingsobject, Verlichtingsobject, Verhardingsobject, Vegetatieobject, Tunnelobject, Terreindeel, Scheiding, Put, Paal, Overbruggingsobject, Meubilair, Mast, Leidingelement, Leiding, Kunstwerk, Kast, Installatie, Groenobject, FunctioneelGebied, Bouwwerk, Bord, Bak"
"/Business/_Sync GEMMA en project/GGM/Bedrijfsobjecten/","ZAKELIJK RECHT","business-object","Het eigendom van, of een beperkt recht van een natuurlijk of niet-natuurlijk persoon (PERSOON) op, een onroerende zaak (met uitzondering van hypotheken en beslagen).","id-4cd17274b1174519b8ef9f267ab6b441","{8C809341-AC60-4378-8BA0-0843E8C06AF3}","Class","06112023-07:59:13","""ggm-"" properties worden beheerd in het GGM informatiemodel","671ec5bd-e8ac-44d7-8a01-cc9b439c6c5f","https://redactie.gemmaonline.nl/index.php/GEMMA2/0.9/id-6f15e2ca-531d-4879-b087-f43559d8c3fd",,"ZAKELIJK RECHT (RSGB Model)","BRK",
"/Business/_Sync GEMMA en project/GGM/Bedrijfsobjecten/","Leges_Grondslag","business-object","","id-4d50a333a93d4cdb9ed0ce6c1968871d","{7F9392E5-6E43-4880-AF14-819E32A86204}","Class","06112023-07:59:13","""ggm-"" properties worden beheerd in het GGM informatiemodel","ce320796-17d5-4134-ade8-7b87211272dd","https://redactie.gemmaonline.nl/index.php/GEMMA2/0.9/id-6f15e2ca-531d-4879-b087-f43559d8c3fd",,,,
"/Business/_Sync GEMMA en project/GGM/Bedrijfsobjecten/","Offerte","business-object","Aanbod, aanbieding of voorstel van goederen of diensten waarin opgave is gedaan van de prijs.","id-4de70ae0eebd43ff889f06c3b74f218d","{BF21FFA3-3EA6-410a-BC65-7BE5547646B6}","Class","06112023-07:59:13","""ggm-"" properties worden beheerd in het GGM informatiemodel","6d31df7d-b7f9-4f50-be9f-eaf05c697f6e","https://redactie.gemmaonline.nl/index.php/GEMMA2/0.9/id-6f15e2ca-531d-4879-b087-f43559d8c3fd",,"Offerte (Inkoop)",,
"/Business/_Sync GEMMA en project/GGM/Bedrijfsobjecten/","Financiele Situatie","business-object","Verhouding in inkomsten en uitgaven van een persoon of bedrijf","id-4e085508e9af47d993fb9e004ca1faec","{5CC59215-5A63-4ef8-9D64-C4FAC0619121}","Class","06112023-07:59:13","""ggm-"" properties worden beheerd in het GGM informatiemodel","fd84565d-63d3-44a1-84e0-cd0f580cb2ad","https://redactie.gemmaonline.nl/index.php/GEMMA2/0.9/id-6f15e2ca-531d-4879-b087-f43559d8c3fd",,,,
"/Business/_Sync GEMMA en project/GGM/Bedrijfsobjecten/","Aanvraag Leerlingenvervoer","business-object","Een aanvraag voor een leerling die recht heeft op vervoer van en naar onderwijs.","id-4ede8451260a4237943d983dee5931a1","{07F40D10-74AC-4f56-8B71-A236A63C2122}","Class","06112023-07:59:13","""ggm-"" properties worden beheerd in het GGM informatiemodel","41c1c340-9952-4bd9-8f45-fec2c0a1ddd7","https://redactie.gemmaonline.nl/index.php/GEMMA2/0.9/id-6f15e2ca-531d-4879-b087-f43559d8c3fd",,,,
"/Business/_Sync GEMMA en project/GGM/Bedrijfsobjecten/","Onderhoud","business-object","Maatregelen om de functionele kwaliteit in stand te houden of te herstellen en dus de levensduur van een (object)onderdeel te realiseren c.q. te verlengen.","id-4f593fdf641d4038b59cbe109e8e5fd4","{960BB2E0-C17F-4c89-90DD-3006CC5F0F75}","Class","06112023-07:59:13","""ggm-"" properties worden beheerd in het GGM informatiemodel","c25777ae-ed48-4285-b244-66715cd2e299","https://redactie.gemmaonline.nl/index.php/GEMMA2/0.9/id-6f15e2ca-531d-4879-b087-f43559d8c3fd",,,,
"/Business/_Sync GEMMA en project/GGM/Bedrijfsobjecten/","Inburgeringstraject","business-object","","id-4fe3debd52264c8a97eb6d0f717b7a6b","{F9B2A863-63C8-4229-906A-D0891BB4F021}","Class","06112023-07:59:13","""ggm-"" properties worden beheerd in het GGM informatiemodel","e1620918-61a7-4cef-b0e2-6b8e206608c8","https://redactie.gemmaonline.nl/index.php/GEMMA2/0.9/id-6f15e2ca-531d-4879-b087-f43559d8c3fd",,,,
"/Business/_Sync GEMMA en project/GGM/Bedrijfsobjecten/","Uitschrijving","business-object","Beeindiging van een inschrijving van een leerling bij een school","id-50423056d9614e28b5417ac5ddcf042e","{133AF611-9FA0-4a09-BF12-74C5FA5F6F60}","Class","06112023-07:59:13","""ggm-"" properties worden beheerd in het GGM informatiemodel","b83efc57-9184-4405-8c23-fbcabe7577b4","https://redactie.gemmaonline.nl/index.php/GEMMA2/0.9/id-6f15e2ca-531d-4879-b087-f43559d8c3fd",,,,
