"folder","name","type","documentation","id","ggm-guid","ggm-uml-type","ggm-datum-tijd-export","Let op","Object ID","GEMMA URL","synoniemen","alternate name","bron","Meer specifiek"
"/Business/_Sync GEMMA en project/GGM/Bedrijfsobjecten/","Werknemer","business-object","De contractuele wederpartij van de werkgever bij de arbeidsovereenkomst.","id-0055aa89ea4a436ca00b5b930ce235d7","{BBBB63AC-B546-409b-B6D4-53DB561253B7}","Class","06112023-07:59:13","""ggm-"" properties worden beheerd in het GGM informatiemodel","8c200706-b80b-44f7-9928-bec39e0db21f","https://redactie.gemmaonline.nl/index.php/GEMMA2/0.9/id-6f15e2ca-531d-4879-b087-f43559d8c3fd",,,,
"/Business/_Sync GEMMA en project/GGM/Bedrijfsobjecten/","OpenbareActiviteit","business-object","Activiteit in het publieke domein","id-00d9ab50ad9c4b6e95f6f487a6169881","{B2B423C3-B9C9-4b4f-A47D-85D29417B9B4}","Class","06112023-07:59:13","""ggm-"" properties worden beheerd in het GGM informatiemodel","9ffbd7f6-a815-4edd-9252-5ed7e873c6a0","https://redactie.gemmaonline.nl/index.php/GEMMA2/0.9/id-6f15e2ca-531d-4879-b087-f43559d8c3fd",,,,
"/Business/_Sync GEMMA en project/GGM/Bedrijfsobjecten/","Aanvraag","business-object","(officieel) verzoek, iets (officieel) vragen aan een bevoegde macht.","id-010e27e8116f407e94fdf4665bddf724","{446E3931-B9F2-4b5c-80E7-5B240B8F816F}","Class","06112023-07:59:13","""ggm-"" properties worden beheerd in het GGM informatiemodel","b8b3fe1a-ea07-49a3-8580-4291afa6f26d","https://redactie.gemmaonline.nl/index.php/GEMMA2/0.9/id-6f15e2ca-531d-4879-b087-f43559d8c3fd","Verzoek","Aanvraag (ICT)",,
"/Business/_Sync GEMMA en project/GGM/Bedrijfsobjecten/","Magazijnplaatsing","business-object","Het ergens neerzetten van een object in een magazijn.","id-0110f94c0ebb4ae39c28ff69e05b4f38","{F954FB72-AE88-4a0e-A3D8-555FCF8D9C9F}","Class","06112023-07:59:13","""ggm-"" properties worden beheerd in het GGM informatiemodel","b46a7928-928b-4ad4-9c27-f3d112073ea0","https://redactie.gemmaonline.nl/index.php/GEMMA2/0.9/id-6f15e2ca-531d-4879-b087-f43559d8c3fd",,,,
"/Business/_Sync GEMMA en project/GGM/Bedrijfsobjecten/","Binnenlocatie","business-object","Locatie binnen een gebouw","id-0145411e6f1d45ad85ed2a30c66c5fd2","{6508657D-7C3F-4261-B647-5D3B077A20F9}","Class","06112023-07:59:13","""ggm-"" properties worden beheerd in het GGM informatiemodel","cda4149f-f0a0-44d9-b893-25bcce04d20d","https://redactie.gemmaonline.nl/index.php/GEMMA2/0.9/id-6f15e2ca-531d-4879-b087-f43559d8c3fd",,,,
"/Business/_Sync GEMMA en project/GGM/Bedrijfsobjecten/","Inschrijving","business-object","Deelname van iemand aan een opleiding bij een onderwijsinstelling.","id-015e94bea0744e8b9d4b49f3eaa3df64","{CFFD5F20-5FA9-4d93-AD34-6867D64A58B9}","Class","06112023-07:59:13","""ggm-"" properties worden beheerd in het GGM informatiemodel","5e8930d4-8f06-4075-bf2b-31f45ee86dbc","https://redactie.gemmaonline.nl/index.php/GEMMA2/0.9/id-6f15e2ca-531d-4879-b087-f43559d8c3fd",,"Inschrijving (Onderwijs)",,
"/Business/_Sync GEMMA en project/GGM/Bedrijfsobjecten/","Commissie","business-object","Een groep mensen die is samengesteld om een specifieke taak, opdracht of onderzoek uit te voeren","id-02a929666f3a4c08b764b668d126e001","{CB27D699-F82B-45ad-823A-B2B51BCAECBA}","Class","06112023-07:59:13","""ggm-"" properties worden beheerd in het GGM informatiemodel","62126697-6498-4c0a-a84e-2275138c2eaa","https://redactie.gemmaonline.nl/index.php/GEMMA2/0.9/id-6f15e2ca-531d-4879-b087-f43559d8c3fd",,,,
"/Business/_Sync GEMMA en project/GGM/Bedrijfsobjecten/","Leerling","business-object","Mens die een opleiding volgt, heeft gevolgd of gaat volgen of opgaat of is opgegaan voor een toets. (Bron: KOI)","id-02e598c278af4227b0efcc526b967ef8","{266057AF-58BD-42e1-B4D5-16EB266B9B7A}","Class","06112023-07:59:13","""ggm-"" properties worden beheerd in het GGM informatiemodel","e2ea124f-56ce-4614-9e32-0f13371a5ede","https://redactie.gemmaonline.nl/index.php/GEMMA2/0.9/id-6f15e2ca-531d-4879-b087-f43559d8c3fd","Onderwijsvolger",,,
"/Business/_Sync GEMMA en project/GGM/Bedrijfsobjecten/","Begrotingregel","business-object","Een item op de begroting","id-036d7ad3033544f5ab0952dedf376c0a","{87964E36-9FEE-4b8f-A053-C4EDAF000646}","Class","06112023-07:59:13","""ggm-"" properties worden beheerd in het GGM informatiemodel","ecb0f96e-e66d-48fb-ade1-416366d1b18e","https://redactie.gemmaonline.nl/index.php/GEMMA2/0.9/id-6f15e2ca-531d-4879-b087-f43559d8c3fd",,,,
"/Business/_Sync GEMMA en project/GGM/Bedrijfsobjecten/","Traject","business-object","Samenstel van achtereenvolgens uit te voeren en onderling samenhangende deelhandelingen of van opeenvolgende stadia in een proces, voorgesteld als een route die via opeenvolgende bestemmingen naar de eindbestemming voert.","id-03972958be3a4c7e86bb0f4983da203e","{AB20D9F3-FBEB-4d10-A8A5-429F0AB8432F}","Class","06112023-07:59:13","""ggm-"" properties worden beheerd in het GGM informatiemodel","99429638-0270-43f5-8193-409379bc10e5","https://redactie.gemmaonline.nl/index.php/GEMMA2/0.9/id-6f15e2ca-531d-4879-b087-f43559d8c3fd",,"Traject (Participatie)",,
"/Business/_Sync GEMMA en project/GGM/Bedrijfsobjecten/","Aanwezige Deelnemer","business-object","iemand die meedoet aan eencollege- of raadsvergadering","id-05a2c41bd2464d6587a6047e4f7b5303","{F1E55DC7-0F33-40ea-8713-2E1AC3D7EE8D}","Class","06112023-07:59:13","""ggm-"" properties worden beheerd in het GGM informatiemodel","ccf78bc5-8d4a-440f-a642-abcf60149628","https://redactie.gemmaonline.nl/index.php/GEMMA2/0.9/id-6f15e2ca-531d-4879-b087-f43559d8c3fd",,,,
"/Business/_Sync GEMMA en project/GGM/Bedrijfsobjecten/","Doelgroep","business-object","Een groep mensen of klanten die een bedrijf of organisatie wil benaderen om een product, dienst of informatie onder de aandacht te brengen","id-0696561a004c4d5daa93339a57487cb2","{4E2B16CA-093A-40b8-B7F8-AD90D7D396A7}","Class","06112023-07:59:13","""ggm-"" properties worden beheerd in het GGM informatiemodel","953e583a-1d8e-4153-bf27-9ad07d80252d","https://redactie.gemmaonline.nl/index.php/GEMMA2/0.9/id-6f15e2ca-531d-4879-b087-f43559d8c3fd",,,,
"/Business/_Sync GEMMA en project/GGM/Bedrijfsobjecten/","Project","business-object","Geheel van activiteiten uitgevoerd in een tijdelijk samenwerkingsverband gericht op het binnen bepaalde randvoorwaarden (bv. tijd, geld) bereiken van een vooraf gedefinieerd resultaat.","id-06c4be37a3ea4c878b89665ef189bad9","{E42A32F7-262F-4005-9EB9-4674B76E8825}","Class","06112023-07:59:13","""ggm-"" properties worden beheerd in het GGM informatiemodel","e323b2d5-5d15-43bf-b305-ecdb62da91d9","https://redactie.gemmaonline.nl/index.php/GEMMA2/0.9/id-6f15e2ca-531d-4879-b087-f43559d8c3fd",,"Project (Archeologie)",,
"/Business/_Sync GEMMA en project/GGM/Bedrijfsobjecten/","Regel voor Iedereen","business-object","Een Juridische regel die voor eenieder werking heeft","id-0737b837d1d3462ba0abe2a27e242da7","{3D9D2E7B-525E-43d9-B08F-EDE47F8A0C94}","Class","06112023-07:59:13","""ggm-"" properties worden beheerd in het GGM informatiemodel","1c3ee208-9d74-45ba-9836-3f3ea165cd74","https://redactie.gemmaonline.nl/index.php/GEMMA2/0.9/id-6f15e2ca-531d-4879-b087-f43559d8c3fd",,,,
"/Business/_Sync GEMMA en project/GGM/Bedrijfsobjecten/","MAATSCHAPPELIJKE ACTIVITEIT","business-object","Een verband tussen één of meer personen met voldoende mate van zelfstandigheid, inbreng van arbeid of middelen, winstoogmerk en extern optreden (i.g.v. een onderneming) dan wel een in een organisatorisch verband, dat toebehoort aan een niet-natuurlijk persoon welke registratieplichtig is, uitgeoefende activiteit die niet valt onder de criteria voor onderneming of bedrijfsmatigheid welke adresseerbaar is middels ofwel een vestiging ofwel het adres van een bepaalde vertegenwoordiger (i.g.v. een niet-ondernemings-activiteit).","id-075524dddf9d4c4ea0f83e1d17bc8f43","{3DC85114-5C3F-4930-B98B-6EB6ED71FC2E}","Class","06112023-07:59:13","""ggm-"" properties worden beheerd in het GGM informatiemodel","82773f8d-3aa1-4e1f-b6de-9284a1851960","https://redactie.gemmaonline.nl/index.php/GEMMA2/0.9/id-6f15e2ca-531d-4879-b087-f43559d8c3fd",,,"NHR",
"/Business/_Sync GEMMA en project/GGM/Bedrijfsobjecten/","REISDOCUMENT","business-object","Een document dat vereist is voor reizen naar het buitenland","id-07cb7da54dac4181839b23d677fefd4e","{CA9BC1BB-D572-4e47-BECF-17CFD379BD6A}","Class","06112023-07:59:13","""ggm-"" properties worden beheerd in het GGM informatiemodel","bd460a48-7720-465d-b12b-c15097ec620c","https://redactie.gemmaonline.nl/index.php/GEMMA2/0.9/id-6f15e2ca-531d-4879-b087-f43559d8c3fd",,,"BRP",
"/Business/_Sync GEMMA en project/GGM/Bedrijfsobjecten/","Bruikleen","business-object","Lening voor tijdelijk gebruik","id-07ce9dc2606a490ebcf1d1e1fda0d69c","{452312FD-05FB-4abc-A48B-C605F7E3E193}","Class","06112023-07:59:13","""ggm-"" properties worden beheerd in het GGM informatiemodel","d1a889c0-4455-4121-9def-df4004050918","https://redactie.gemmaonline.nl/index.php/GEMMA2/0.9/id-6f15e2ca-531d-4879-b087-f43559d8c3fd",,,,
"/Business/_Sync GEMMA en project/GGM/Bedrijfsobjecten/","Agendapunt","business-object","Een onderwerp dat in de vergadering wordt behandeld.","id-0809845f04624451b22e650703828145","{73FB5212-40ED-40dc-B837-36588840445A}","Class","06112023-07:59:13","""ggm-"" properties worden beheerd in het GGM informatiemodel","34b2e5f9-63ab-42e8-bfa9-85e12ff6e417","https://redactie.gemmaonline.nl/index.php/GEMMA2/0.9/id-6f15e2ca-531d-4879-b087-f43559d8c3fd",,,,
"/Business/_Sync GEMMA en project/GGM/Bedrijfsobjecten/","OPENBARE RUIMTE","business-object","Definitie
Een openbare ruimte is een door het bevoegde gemeentelijke orgaan als zodanig aangewezen en van een naam voorziene buitenruimte die binnen &#233;&#233;n woonplaats is gelegen.

Beschrijving
Een buitenruimte die door de gemeente als openbare ruimte is aangewezen en waaraan de gemeente een naam heeft gegeven. Een openbare ruimte ligt binnen 1 woonplaats. De BAG kent 7 soorten openbare ruimten: weg, water, spoorbaan, terrein, kunstwerk, landschappelijk gebied en administratief gebied. Een openbare ruimte is meestal een straat(naam).","id-08b4a170f7984dfaaf7436a120a4708c","{BFE30E32-8CB9-4272-A559-9FB3FD74DACC}","Class","06112023-07:59:13","""ggm-"" properties worden beheerd in het GGM informatiemodel","d2f8867b-fce6-4932-8b1a-ec8b9392f0d5","https://redactie.gemmaonline.nl/index.php/GEMMA2/0.9/id-6f15e2ca-531d-4879-b087-f43559d8c3fd",,"OPENBARE RUIMTE (BAG)","BAG",
"/Business/_Sync GEMMA en project/GGM/Bedrijfsobjecten/","Bak","business-object","Object met een permanent karakter dat dient om iets in te bergen of te verzamelen. (bron: definities.geostandaarden.nl)
Synoniemen: Bak","id-0990071f4037492a85b2d777415f47dd","{6B54FE2F-9897-47DA-863C-5A931E89B2D}","Class","06112023-07:59:13","""ggm-"" properties worden beheerd in het GGM informatiemodel","10c774ed-95dc-4186-b425-c19c187b90ff","https://redactie.gemmaonline.nl/index.php/GEMMA2/0.9/id-6f15e2ca-531d-4879-b087-f43559d8c3fd",,,,"Afvalbak"
"/Business/_Sync GEMMA en project/GGM/Bedrijfsobjecten/","Uitstroomreden","business-object","Motivatie voor uitstroom","id-09e2ce17231f4711b7ba3a0db46c5f4c","{42D33289-422A-4d94-BE6B-44B34CC230B5}","Class","06112023-07:59:13","""ggm-"" properties worden beheerd in het GGM informatiemodel","310e7b8f-87b6-4493-8b66-1b222428dea4","https://redactie.gemmaonline.nl/index.php/GEMMA2/0.9/id-6f15e2ca-531d-4879-b087-f43559d8c3fd",,,,
"/Business/_Sync GEMMA en project/GGM/Bedrijfsobjecten/","Kosten","business-object","","id-0a91e91f231e4d1980ea7be529507dea","{0E4A8F94-ED08-43dc-9F78-C9DD17D34690}","Class","06112023-07:59:13","""ggm-"" properties worden beheerd in het GGM informatiemodel","b3ca70ae-c2de-4728-ac7d-a144a95c858e","https://redactie.gemmaonline.nl/index.php/GEMMA2/0.9/id-6f15e2ca-531d-4879-b087-f43559d8c3fd",,,,
"/Business/_Sync GEMMA en project/GGM/Bedrijfsobjecten/","Video-opname","business-object","Opnametechniek om bewegende beelden als een elektronisch signaal te registreren en weer te geven.","id-0ba38d37b9f344d7b2f17dd4e7e10be4","{435883D2-C399-4590-B4F5-B07111103484}","Class","06112023-07:59:13","""ggm-"" properties worden beheerd in het GGM informatiemodel","1d49cf98-d059-42da-bdd4-d076f8ace453","https://redactie.gemmaonline.nl/index.php/GEMMA2/0.9/id-6f15e2ca-531d-4879-b087-f43559d8c3fd",,,,
"/Business/_Sync GEMMA en project/GGM/Bedrijfsobjecten/","School","business-object","Gebouw in gebruik voor basis, middelbaar of hoger onderwijs.","id-0be184699de94372ad5350ac2d995ffa","{32DFC5DD-79D9-45d5-8F9D-7D5125961817}","Class","06112023-07:59:13","""ggm-"" properties worden beheerd in het GGM informatiemodel","f2c26bb2-4c76-4b03-8ceb-6397b5a12ae8","https://redactie.gemmaonline.nl/index.php/GEMMA2/0.9/id-6f15e2ca-531d-4879-b087-f43559d8c3fd",,,,
"/Business/_Sync GEMMA en project/GGM/Bedrijfsobjecten/","Productie-eenheid","business-object","Een (deel van een) productiemiddel, dat zelfstandig (ofwel onafhankelijk van de andere delen van het desbetreffende productiemiddel) kan worden ingezet.","id-0c2e165783e649d7a70d94d28cfb1522","{D3EF17C3-8100-4a61-9E67-F20924C15CEA}","Class","06112023-07:59:13","""ggm-"" properties worden beheerd in het GGM informatiemodel","15fbcddb-67b4-48a7-b2a6-1c11c514130b","https://redactie.gemmaonline.nl/index.php/GEMMA2/0.9/id-6f15e2ca-531d-4879-b087-f43559d8c3fd",,,,
"/Business/_Sync GEMMA en project/GGM/Bedrijfsobjecten/","STATUS","business-object","<font color=""#610e6a"">Een aanduiding van de stand van zaken van een zaak op basis van betekenisvol behaald resultaat voor de initiator van de zaak.</font>","id-0cdc9f47043949f38e400cac541ef2e6","{7C975D37-670B-405e-B825-924BCAFA74C7}","Class","06112023-07:59:13","""ggm-"" properties worden beheerd in het GGM informatiemodel","138f7a81-f370-4e0c-9254-d6c7727a338c","https://redactie.gemmaonline.nl/index.php/GEMMA2/0.9/id-6f15e2ca-531d-4879-b087-f43559d8c3fd",,,,
"/Business/_Sync GEMMA en project/GGM/Bedrijfsobjecten/","Notitie","business-object","Korte, zakelijke uiteenzetting op schrift","id-0e845af01a6347d3bdd76c77a68c0eb2","{354E5545-D067-4b81-9D1D-C5F5FFB532C7}","Class","06112023-07:59:13","""ggm-"" properties worden beheerd in het GGM informatiemodel","ca903c71-96d8-4db2-9aa9-52210dd02c1d","https://redactie.gemmaonline.nl/index.php/GEMMA2/0.9/id-6f15e2ca-531d-4879-b087-f43559d8c3fd",,,,
"/Business/_Sync GEMMA en project/GGM/Bedrijfsobjecten/","Verkeerstelling","business-object","Een onderzoek om inzicht te krijgen in het verkeer, in de hoeveelheid verkeer, de verdeling en de gereden snelheid.","id-0ea05b9864354f61983c60121f7d8892","{DBE739FD-EBC4-4650-8A2B-714294A63A73}","Class","06112023-07:59:13","""ggm-"" properties worden beheerd in het GGM informatiemodel","cb656c23-5e43-4f7d-9c06-ff5351911fdb","https://redactie.gemmaonline.nl/index.php/GEMMA2/0.9/id-6f15e2ca-531d-4879-b087-f43559d8c3fd",,,,
"/Business/_Sync GEMMA en project/GGM/Bedrijfsobjecten/","Vorderingregel","business-object","","id-0f26ed163a89497abb6fc2016327df17","{E2B83F97-FDFD-4876-9E66-23D79D4A4C03}","Class","06112023-07:59:13","""ggm-"" properties worden beheerd in het GGM informatiemodel","0ca1b8c3-e144-45c1-b3e8-4a97f7653fd1","https://redactie.gemmaonline.nl/index.php/GEMMA2/0.9/id-6f15e2ca-531d-4879-b087-f43559d8c3fd",,,,
"/Business/_Sync GEMMA en project/GGM/Bedrijfsobjecten/","Precario","business-object","Belasting die specifiek wordt geheven voor het plaatsen van voorwerpen onder, op of boven voor de openbare dienst bestemde gemeentegrond.","id-0f29ba740c5949ef9338a86050b15ddf","{13BB343D-A595-43c9-8208-9BC5B05B618C}","Class","06112023-07:59:13","""ggm-"" properties worden beheerd in het GGM informatiemodel","01e036d1-b350-4782-b31b-7ac54ea39339","https://redactie.gemmaonline.nl/index.php/GEMMA2/0.9/id-6f15e2ca-531d-4879-b087-f43559d8c3fd",,,,
"/Business/_Sync GEMMA en project/GGM/Bedrijfsobjecten/","Samensteller","business-object","Iemand die stukken informatie samenbrengt in tentoonstelingen, presentaties en naslagwerken.","id-0fbb878eebee4ffbb55ef7d04e6facf6","{E5566AF6-3D43-4b2f-B658-F67F6C1C511D}","Class","06112023-07:59:13","""ggm-"" properties worden beheerd in het GGM informatiemodel","9a4512b0-6081-4f32-bec9-8f2b62e62761","https://redactie.gemmaonline.nl/index.php/GEMMA2/0.9/id-6f15e2ca-531d-4879-b087-f43559d8c3fd",,,,
"/Business/_Sync GEMMA en project/GGM/Bedrijfsobjecten/","Kunstwerk","business-object","Civiel-technisch werk voor de infrastructuur van wegen, water, spoorbanen, waterkeringen en/of leidingen en niet bedoeld voor permanent menselijk verblijf. http://definities.geostandaarden.nl","id-1073f674a837459cbdf926c206e49ccc","{71BCDE9D-88C2-4519-8105-028E40898AB}","Class","06112023-07:59:13","""ggm-"" properties worden beheerd in het GGM informatiemodel","0e1bf1cd-7cce-4904-8470-40cb9d6a5bb6","https://redactie.gemmaonline.nl/index.php/GEMMA2/0.9/id-6f15e2ca-531d-4879-b087-f43559d8c3fd",,,,"Uitlaatconstructie, Overstortconstructie, Gemaal"
"/Business/_Sync GEMMA en project/GGM/Bedrijfsobjecten/","ADRESSEERBAAR OBJECT","business-object","Definitie
Een adresseerbaar object is een object waaraan formeel adressen kunnen en moeten worden toegekend: een verblijfsobject, standplaats of ligplaats.

Is generalisatie van
ligplaats
standplaats
verblijfsobject

Toelichting
Een object dat een adres heeft of krijgt. Adresseerbare objecten zijn: een verblijfsobject, een standplaats en een ligplaats.","id-10e4278e9eaa44a4800cde0d21bacdd0","{8A04280B-E0B4-4e36-B448-C99750393D0D}","Class","06112023-07:59:13","""ggm-"" properties worden beheerd in het GGM informatiemodel","460ada62-9cdd-478f-9555-4fb161ebc0b3","https://redactie.gemmaonline.nl/index.php/GEMMA2/0.9/id-6f15e2ca-531d-4879-b087-f43559d8c3fd",,,"BAG","VERBLIJFSOBJECT, STANDPLAATS, LIGPLAATS"
"/Business/_Sync GEMMA en project/GGM/Bedrijfsobjecten/","Locatie","business-object","De locatie beschrijft middels co√∂rdinaten de ruimtelijke dimensie of ruimtelijke afbakening van een regel of van een objecttype die in de regel beschreven wordt. (CIMOW)","id-121a3581021a47b48d99d9fbf7a2efec","{79284529-B817-4e3f-BE51-AEAFC60BDE44}","Class","06112023-07:59:13","""ggm-"" properties worden beheerd in het GGM informatiemodel","f1220c91-e576-4a25-9cdb-0a2b991ae362","https://redactie.gemmaonline.nl/index.php/GEMMA2/0.9/id-6f15e2ca-531d-4879-b087-f43559d8c3fd",,"Locatie (Generiek)",,"Puntengroep, Lijnengroep, Gebiedengroep, Punt, Lijn, Gebied"
"/Business/_Sync GEMMA en project/GGM/Bedrijfsobjecten/","Gebiedsaanwijzing","business-object","Functie of een Beperkingengebied, met een verwijzing naar locatie, veelal een gebied, waarbij aangegeven wordt hoe het gebied beschouwd wordt vanuit de bijbehorende regels.","id-124864ffdaf7415fa1e06246c92c235f","{503BD06E-E063-46f2-8B43-BF75A143D6C4}","Class","06112023-07:59:13","""ggm-"" properties worden beheerd in het GGM informatiemodel","8ffff080-afa5-43cf-a1dc-1ab2052f20ac","https://redactie.gemmaonline.nl/index.php/GEMMA2/0.9/id-6f15e2ca-531d-4879-b087-f43559d8c3fd",,,,"Functie, Beperkingsgebied"
"/Business/_Sync GEMMA en project/GGM/Bedrijfsobjecten/","Toewijzing","business-object","Toewijzing die door gemeente aan zorgaanbieder wordt gestuurd. zie https://informatiemodel.istandaarden.nl/2019/views/view_274300.html","id-1363c4ebdc3a4456bba93831fe1c1c1e","{01ECE551-A7B0-4b99-B6E7-F654D6AC15D5}","Class","06112023-07:59:13","""ggm-"" properties worden beheerd in het GGM informatiemodel","53cc8281-81c1-40c8-901d-2751e34ea367","https://redactie.gemmaonline.nl/index.php/GEMMA2/0.9/id-6f15e2ca-531d-4879-b087-f43559d8c3fd",,,,
"/Business/_Sync GEMMA en project/GGM/Bedrijfsobjecten/","KADASTRALE ONROERENDE ZAAK","business-object","Een geregistreerd goed waarvoor bij overdracht of vestiging van rechten inschrijving in de openbare registers van het Kadaster is vereist zijnde een KADASTRAAL PERCEEL of een APPARTEMENTSRECHT.","id-13898c7170834e49917d4593061da0f6","{9775E778-DBF8-4122-94CE-551466B62F46}","Class","06112023-07:59:13","""ggm-"" properties worden beheerd in het GGM informatiemodel","8155eb9b-eb9e-4eec-a850-80c185983a9f","https://redactie.gemmaonline.nl/index.php/GEMMA2/0.9/id-6f15e2ca-531d-4879-b087-f43559d8c3fd",,,"BRK","KADASTRAAL PERCEEL, APPARTEMENTSRECHT"
"/Business/_Sync GEMMA en project/GGM/Bedrijfsobjecten/","Functiehuis","business-object","Model waarin functies van een organisatie worden beschreven.","id-14ad99f282854eab90d9cc9d0214eb75","{D69EE16A-390C-4d6f-BC01-2B13FB3B22F1}","Class","06112023-07:59:13","""ggm-"" properties worden beheerd in het GGM informatiemodel","b7ad73b1-bea5-48e8-acaa-d6031c3078ce","https://redactie.gemmaonline.nl/index.php/GEMMA2/0.9/id-6f15e2ca-531d-4879-b087-f43559d8c3fd",,,,
"/Business/_Sync GEMMA en project/GGM/Bedrijfsobjecten/","Archief","business-object","De bewaarplaats van belangrijke gegevens die zijn vastgelegd in documentvorm alsook de verzameling van documenten die voor een bepaald doel vervaardigd zijn.","id-15a48c3c59f24a1e98334d84b4979f2f","{E09E5B44-4D39-455a-B0A5-390A63AC0C43}","Class","06112023-07:59:13","""ggm-"" properties worden beheerd in het GGM informatiemodel","6b072b67-e13f-422e-9e5c-068deb532aad","https://redactie.gemmaonline.nl/index.php/GEMMA2/0.9/id-6f15e2ca-531d-4879-b087-f43559d8c3fd",,,,
"/Business/_Sync GEMMA en project/GGM/Bedrijfsobjecten/","Linkbaar CMDB-item","business-object","Niet opnemen","id-15be5d14dcea4d09a4a303bd15494b95","{C0F1A08E-C6CD-4524-A2E0-0E5CA483DCFD}","Class","06112023-07:59:13","""ggm-"" properties worden beheerd in het GGM informatiemodel","5003634c-22b1-4f9a-bf73-8cdb4c42a8b4","https://redactie.gemmaonline.nl/index.php/GEMMA2/0.9/id-6f15e2ca-531d-4879-b087-f43559d8c3fd",,,,"Applicatie, Database, Server"
"/Business/_Sync GEMMA en project/GGM/Bedrijfsobjecten/","Ziekmelding Leerlingenvervoer","business-object","Een melding van een zieke leerling die recht heeft op vervoer van en naar onderwijs.","id-164cc1fbe6e846f98cb6ff70e5923b5e","{7689A6B7-2A9E-42db-A028-E4601305DBFF}","Class","06112023-07:59:13","""ggm-"" properties worden beheerd in het GGM informatiemodel","7c4345ce-0561-47eb-ad3d-4b21f15687e3","https://redactie.gemmaonline.nl/index.php/GEMMA2/0.9/id-6f15e2ca-531d-4879-b087-f43559d8c3fd",,,,
"/Business/_Sync GEMMA en project/GGM/Bedrijfsobjecten/","BETROKKENE","business-object","<font color=""#610e6a"">Een SUBJECT, zijnde een NATUURLIJK PERSOON, NIET-NATUURLIJK PERSOON of VESTIGING, ORGANISATORISCHE EENHEID (binnen een vestiging van de zaak-behandelende niet-natuurlijk persoon), of MEDEWERKER (van die organisatorische eenheid) die een rol kan spelen bij een ZAAK.</font>","id-16d96fb2c1f84820903ba2038f4d5eec","{16FB8171-A9ED-4027-A663-C035509501C8}","Class","06112023-07:59:13","""ggm-"" properties worden beheerd in het GGM informatiemodel","62c91622-cc32-4560-8427-d00101f4847e","https://redactie.gemmaonline.nl/index.php/GEMMA2/0.9/id-6f15e2ca-531d-4879-b087-f43559d8c3fd",,,,
"/Business/_Sync GEMMA en project/GGM/Bedrijfsobjecten/","VESTIGING VAN ZAAKBEHANDELENDE ORGANISATIE","business-object","<font color=""#610e6a"">Een VESTIGING van een onderneming of rechtspersoon zijnde de zaakbehandelende organisatie.</font>","id-1790033c83634639ac8263e185a3d549","{D8142B98-64CB-408e-9941-92423543F08A}","Class","06112023-07:59:13","""ggm-"" properties worden beheerd in het GGM informatiemodel","bb257165-3229-4e5f-a24c-524966c748f5","https://redactie.gemmaonline.nl/index.php/GEMMA2/0.9/id-6f15e2ca-531d-4879-b087-f43559d8c3fd",,,,
"/Business/_Sync GEMMA en project/GGM/Bedrijfsobjecten/","Stremming","business-object","Situatie waarbij de doorstroming van het (vaar)wegverkeer plaatselijk is geblokkeerd als gevolg van een incident","id-18384829879144879bde9d2ab175f2b1","{999725EE-737F-410e-906B-9865EBED3597}","Class","06112023-07:59:13","""ggm-"" properties worden beheerd in het GGM informatiemodel","563fd27c-7299-4311-8f40-60a95b9da4b5","https://redactie.gemmaonline.nl/index.php/GEMMA2/0.9/id-6f15e2ca-531d-4879-b087-f43559d8c3fd",,,,
"/Business/_Sync GEMMA en project/GGM/Bedrijfsobjecten/","LOCATIEAANDUIDING WOZ OBJECT","business-object","Nadere aanduiding van het WOZ-object","id-18455b1808674e17a84f5072e725b33d","{0B3F8A89-F21E-4bea-9620-8D6713AB632C}","Class","06112023-07:59:13","""ggm-"" properties worden beheerd in het GGM informatiemodel","9155e64f-138f-4269-bd68-46f217cb33c3","https://redactie.gemmaonline.nl/index.php/GEMMA2/0.9/id-6f15e2ca-531d-4879-b087-f43559d8c3fd",,,,
"/Business/_Sync GEMMA en project/GGM/Bedrijfsobjecten/","HUISHOUDEN","business-object","Een duurzame samenlevingsvorm van een of meer natuurlijke personen binnen een VERBLIJFSOBJECT, STANDPLAATS of LIGPLAATS.","id-1858728c2d3947359c0246994363064c","{6FB0A5B7-7B5F-437f-A462-4B1EADB964E4}","Class","06112023-07:59:13","""ggm-"" properties worden beheerd in het GGM informatiemodel","2515abf4-dea2-44eb-8886-c90c1ab42069","https://redactie.gemmaonline.nl/index.php/GEMMA2/0.9/id-6f15e2ca-531d-4879-b087-f43559d8c3fd",,"HUISHOUDEN (RSGB Model)",,
"/Business/_Sync GEMMA en project/GGM/Bedrijfsobjecten/","Klacht Leerlingenvervoer","business-object","Een uiting van ontevredenheid over het vervoer van leerlingen.","id-198bab54632f4d279991f0aff413edc6","{07FE66E8-8316-406b-A590-922C2E7B4305}","Class","06112023-07:59:13","""ggm-"" properties worden beheerd in het GGM informatiemodel","df24e948-819b-4201-8dde-3c6865c09230","https://redactie.gemmaonline.nl/index.php/GEMMA2/0.9/id-6f15e2ca-531d-4879-b087-f43559d8c3fd",,,,
"/Business/_Sync GEMMA en project/GGM/Bedrijfsobjecten/","Project","business-object","Geheel van activiteiten uitgevoerd in een tijdelijk samenwerkingsverband gericht op het binnen bepaalde randvoorwaarden (bv. tijd, geld) bereiken van een vooraf gedefinieerd resultaat.","id-19d45be1e7a546ea99dae36a845b2930","{E1FAE16A-42AE-4b7d-88FC-F429079D1C4D}","Class","06112023-07:59:13","""ggm-"" properties worden beheerd in het GGM informatiemodel","14baf353-fdc5-458c-9a2e-66b3ec04d9d0","https://redactie.gemmaonline.nl/index.php/GEMMA2/0.9/id-6f15e2ca-531d-4879-b087-f43559d8c3fd",,"Project (Omgevingswet)",,
