"folder","name","type","documentation","id","ggm-guid","ggm-uml-type","ggm-datum-tijd-export","Let op","Object ID","GEMMA URL","synoniemen","alternate name","bron","Meer specifiek"
"/Business/_Sync GEMMA en project/GGM/Bedrijfsobjecten/","Instructieregel","business-object","<font color=""#032547""><b>Objecttype Instructieregel</b></font>
Naam Definitie
Toelichting
Instructieregel
De beschrijving van een juridische regel die een instructie is voor een extern omgevingsdocument of een orgaan.
Het betreft hier juridische regel die instructie geeft aan andere overheden, gericht op externe omgevingsdocumenten, of een taakuitoefening.
Een ander omgevingsdocument is bijvoorbeeld een Omgevingsplan, Omgevingsverordening en Waterschapsverordening.
Een taakuitoefening is voor bijvoorbeeld een gemeentebestuur of een wildbeheereenheid.
Een instructieregel is alleen gericht op een Omgevingsnorm of een Gebiedsaanduiding, zoals een Functie of een Beperkingengebied (en eventueel meerdere).","id-69b9999a9df54490b36b44969cb8b7d0","{A6C71E4C-CB46-41ae-8A61-C8080BB92A55}","Class","06112023-07:59:13","""ggm-"" properties worden beheerd in het GGM informatiemodel","367532e8-1d1c-4d6b-8a88-fcae7cae2303","https://redactie.gemmaonline.nl/index.php/GEMMA2/0.9/id-6f15e2ca-531d-4879-b087-f43559d8c3fd",,,,
"/Business/_Sync GEMMA en project/GGM/Bedrijfsobjecten/","Briefadres","business-object","","id-69e3c6f1bdcc4824a0af6b45213b5c31","{3015DCE3-7C05-4160-A717-533553258C15}","Class","06112023-07:59:13","""ggm-"" properties worden beheerd in het GGM informatiemodel","af282ab4-d6c4-4a5f-8126-db9b70cff048","https://redactie.gemmaonline.nl/index.php/GEMMA2/0.9/id-6f15e2ca-531d-4879-b087-f43559d8c3fd",,,,
"/Business/_Sync GEMMA en project/GGM/Bedrijfsobjecten/","Log","business-object","Registratie van gegevens.","id-69feddfe7e1245d8af7f537055037cfc","{5492ED6D-608E-465e-B975-BCADAAA3EE7F}","Class","06112023-07:59:13","""ggm-"" properties worden beheerd in het GGM informatiemodel","faf0976b-5000-4eb1-976d-10a3d7edf2c5","https://redactie.gemmaonline.nl/index.php/GEMMA2/0.9/id-6f15e2ca-531d-4879-b087-f43559d8c3fd",,,,
"/Business/_Sync GEMMA en project/GGM/Bedrijfsobjecten/","WOZ-OBJECT","business-object","De onroerende zaak waarvan op grond van de Wet WOZ de waarde moet worden bepaald en vastgesteld.","id-6b197e187d7e4e7a9d73738cb5759944","{CB7BA76D-0793-4d5a-9596-533C5BC56BBF}","Class","06112023-07:59:13","""ggm-"" properties worden beheerd in het GGM informatiemodel","3f1aeea3-a5a8-4df6-af1e-51d5ef4ad32f","https://redactie.gemmaonline.nl/index.php/GEMMA2/0.9/id-6f15e2ca-531d-4879-b087-f43559d8c3fd",,,"BRWOZ",
"/Business/_Sync GEMMA en project/GGM/Bedrijfsobjecten/","Brede Intake","business-object","","id-6dc9d604edca488bb5a5c0bedd648c07","{8B394DCE-C3C4-4262-9460-8EF130E90D83}","Class","06112023-07:59:13","""ggm-"" properties worden beheerd in het GGM informatiemodel","2d7f4231-96e8-4424-a656-c52473ea36dc","https://redactie.gemmaonline.nl/index.php/GEMMA2/0.9/id-6f15e2ca-531d-4879-b087-f43559d8c3fd",,,,
"/Business/_Sync GEMMA en project/GGM/Bedrijfsobjecten/","Verkeersbesluit","business-object","Een besluit van een wegbeheerder om een bepaald verkeersteken te plaatsen, te wijzigen of in te trekken of een bepaalde fysieke maatregel te treffen.","id-6ddc5b2a72e1481f96c21c6aaa9c19ee","{3F83DAA3-C37F-42b2-8D35-D75B840172F8}","Class","06112023-07:59:13","""ggm-"" properties worden beheerd in het GGM informatiemodel","833312cc-f7d8-4b4c-9e79-b21c8e7597cb","https://redactie.gemmaonline.nl/index.php/GEMMA2/0.9/id-6f15e2ca-531d-4879-b087-f43559d8c3fd",,,,
"/Business/_Sync GEMMA en project/GGM/Bedrijfsobjecten/","Klantcontact","business-object","Klantcontacten zijn contactmomenten die werkelijk hebben plaatsgevonden, terwijl Balieafspraken afspraken zijn voor een klantcontact. Dit ongeacht of deze werkelijk heeft plaatsgevonden, soms liggen deze in de toekomst of is iemand niet op komen dagen, of iets anders waardoor het klantcontact nog niet heeft plaatsgevonden.

Hetzelfde geldt voor de telefoontjes, de klantcontacten komen uit levelOneData, dat zijn alle telefoontjes die werkelijk met een medewerker (of een gedelegeerde) hebben plaatsgevonden (soms zelfs meerdere binnen 1 telefoontje).","id-6dfa4f8a5e154aeda9e94c0f98f56af2","{A3DAD553-0E55-4256-824B-CDB5E12CB545}","Class","06112023-07:59:13","""ggm-"" properties worden beheerd in het GGM informatiemodel","a9cb919f-a224-4ab5-9825-40d54104f90d","https://redactie.gemmaonline.nl/index.php/GEMMA2/0.9/id-6f15e2ca-531d-4879-b087-f43559d8c3fd",,,,
"/Business/_Sync GEMMA en project/GGM/Bedrijfsobjecten/","Idealisatie","business-object","Vastlegging van de manier de begrenzing van Locatie voor deze Juridische regel ge√Ønterpreteerd moet worden en door het bevoegd gezag bedoeld is.","id-6dfb83e9413c477fb3d27f491ddd28ea","{4942AB0A-804B-4043-BD3C-7F65E2D697E0}","Class","06112023-07:59:13","""ggm-"" properties worden beheerd in het GGM informatiemodel","2e1ef581-f4f8-4212-9784-5927c5a8993d","https://redactie.gemmaonline.nl/index.php/GEMMA2/0.9/id-6f15e2ca-531d-4879-b087-f43559d8c3fd",,,,
"/Business/_Sync GEMMA en project/GGM/Bedrijfsobjecten/","Toegangsmiddel","business-object","Een middel waarmee men zich toegang tot iets kan verschaffen.","id-6e40a11ccf1d45bc81b4b6b01ee4efe8","{D67A4AC2-9A17-4cd0-82D7-732A89018FDA}","Class","06112023-07:59:13","""ggm-"" properties worden beheerd in het GGM informatiemodel","55c7fd37-4d03-45f4-b374-69aa690d1477","https://redactie.gemmaonline.nl/index.php/GEMMA2/0.9/id-6f15e2ca-531d-4879-b087-f43559d8c3fd",,,,
"/Business/_Sync GEMMA en project/GGM/Bedrijfsobjecten/","Kandidaat","business-object","Iemand die een bepaalde baan of functie wil","id-6ee0fbf6fead4b05abb9f4df51ddd8e1","{75B4E818-5ECD-45c5-98F9-66F57FC6117E}","Class","06112023-07:59:13","""ggm-"" properties worden beheerd in het GGM informatiemodel","dc97ebf4-61ee-47f6-a108-af6bb4a276f7","https://redactie.gemmaonline.nl/index.php/GEMMA2/0.9/id-6f15e2ca-531d-4879-b087-f43559d8c3fd","Gegadigde",,,
"/Business/_Sync GEMMA en project/GGM/Bedrijfsobjecten/","Project","business-object","Geheel van activiteiten uitgevoerd in een tijdelijk samenwerkingsverband gericht op het binnen bepaalde randvoorwaarden (bv. tijd, geld) bereiken van een vooraf gedefinieerd resultaat.","id-6eff9862b23b4adba2a712e07961eac7","{4D1988C7-D607-4b9a-9F53-0FFBBA15BFC9}","Class","06112023-07:59:13","""ggm-"" properties worden beheerd in het GGM informatiemodel","52f89e9c-1b7d-42db-af7a-4d5533dbf82f","https://redactie.gemmaonline.nl/index.php/GEMMA2/0.9/id-6f15e2ca-531d-4879-b087-f43559d8c3fd",,"Project (Schuldhulpverlening)",,
"/Business/_Sync GEMMA en project/GGM/Bedrijfsobjecten/","Standplaats","business-object","vanaf een vaste locatie te koop aanbieden, verkopen of afleveren van goederen of aanbieden van diensten, gebruikmakend van fysieke middelen zoals een kraam, een wagen of een tafel","id-6f5a886cd97145cdb0cb48fb184d8e6d","{98F3132E-F97A-4f49-B4F5-28618BB693F8}","Class","06112023-07:59:13","""ggm-"" properties worden beheerd in het GGM informatiemodel","c9503a2a-eb9b-450f-954d-e374ac65198e","https://redactie.gemmaonline.nl/index.php/GEMMA2/0.9/id-6f15e2ca-531d-4879-b087-f43559d8c3fd",,,,
"/Business/_Sync GEMMA en project/GGM/Bedrijfsobjecten/","Normwaarde","business-object","√â√©n van de kwantitatieve of kwalitatieve waarden van een norm. De normwaarde geeft aan wat de specifieke kwantitatieve of kwalitatieve eisen zijn, inclusief de toewijzing ervan aan de specifieke locatie(s) waar de normwaarde voor geldt.","id-6fb1798ac405450ca60b1d786d2c98d5","{58656D46-644B-4779-A473-739C5636BA0A}","Class","06112023-07:59:13","""ggm-"" properties worden beheerd in het GGM informatiemodel","17f80cfc-0137-4608-9977-eb645ae88729","https://redactie.gemmaonline.nl/index.php/GEMMA2/0.9/id-6f15e2ca-531d-4879-b087-f43559d8c3fd",,,,
"/Business/_Sync GEMMA en project/GGM/Bedrijfsobjecten/","Verzoek om Toewijzing","business-object","Verzoek tot toewijzing dat vanuit leverancier (via H10-portal) aan de gemeente wordt gestuurd. Zie https://informatiemodel.istandaarden.nl/2019/views/view_274300.html","id-6fde7caeb40c438590998718b7b76eb3","{9F392B0B-1654-4b4e-9261-F0A90DA1F7BD}","Class","06112023-07:59:13","""ggm-"" properties worden beheerd in het GGM informatiemodel","e643dc04-a205-421d-ab23-c6da046b1642","https://redactie.gemmaonline.nl/index.php/GEMMA2/0.9/id-6f15e2ca-531d-4879-b087-f43559d8c3fd",,,,
"/Business/_Sync GEMMA en project/GGM/Bedrijfsobjecten/","Hoofdstuk","business-object","Onderdeel van een langere tekst.","id-7002a918e09e46c280618a09d6662afc","{FFAA30D3-91C2-44aa-B52D-B21C51DB0326}","Class","06112023-07:59:13","""ggm-"" properties worden beheerd in het GGM informatiemodel","24693ea2-5032-4c71-a9c7-945b3ac90530","https://redactie.gemmaonline.nl/index.php/GEMMA2/0.9/id-6f15e2ca-531d-4879-b087-f43559d8c3fd",,,,
"/Business/_Sync GEMMA en project/GGM/Bedrijfsobjecten/","ZAAK","business-object","<font color=""#610e6a"">Een samenhangende hoeveelheid werk met een welgedefinieerde aanleiding en een welgedefinieerd eindresultaat, waarvan kwaliteit en doorlooptijd bewaakt moeten worden.</font>","id-703d15170e9d4e4c85cf630991183ea9","{649EFD86-ED52-4293-8577-DBE5445845BF}","Class","06112023-07:59:13","""ggm-"" properties worden beheerd in het GGM informatiemodel","7d5124d4-f23d-432d-ad5a-dc7c1b0fac44","https://redactie.gemmaonline.nl/index.php/GEMMA2/0.9/id-6f15e2ca-531d-4879-b087-f43559d8c3fd",,,,"VTHzaak"
"/Business/_Sync GEMMA en project/GGM/Bedrijfsobjecten/","Verhuurbaar Eenheid","business-object","Een Verhuurbare Eenheid (VHE) is een eenheid die individueel verhuurbaar is. Verhuurbaar komt voort uit 'exploitatie'","id-71b37d66532f4bb3bcefb53188b9049d","{98A7AE65-A061-449a-94CD-6218069CA86A}","Class","06112023-07:59:13","""ggm-"" properties worden beheerd in het GGM informatiemodel","31dcb0af-e9f1-44e1-8d5a-278f887fa9e7","https://redactie.gemmaonline.nl/index.php/GEMMA2/0.9/id-6f15e2ca-531d-4879-b087-f43559d8c3fd",,,,
"/Business/_Sync GEMMA en project/GGM/Bedrijfsobjecten/","Vaartuig","business-object","Een zee- of binnenvaartuig, tot de vaart gebruikt of bestemd, daaronder begrepen drijvende werktuigen, zoals baggerwerktuigen, kranen, bokken, elevators, alsmede woonschepen, glijboten en ponten.","id-73607a0fb2394aa19e788cfba0c7f259","{D12123D3-D62D-4978-B7D4-8405F00A0D6A}","Class","06112023-07:59:13","""ggm-"" properties worden beheerd in het GGM informatiemodel","3d86eebe-43ff-498e-9f8c-7c77a35f8730","https://redactie.gemmaonline.nl/index.php/GEMMA2/0.9/id-6f15e2ca-531d-4879-b087-f43559d8c3fd",,,,
"/Business/_Sync GEMMA en project/GGM/Bedrijfsobjecten/","APPARTEMENTSRECHTSPLITSING","business-object","Het recht op een stuk grond of op een gebouw met toebehoren op de daarbij behorende grond met toebehoren is gesplitst in appartementsrechten.","id-738daa2570f742c385b3392eb3eaa774","{C1542AC8-2F3C-4e62-ADFA-A9FB3358DAB1}","Class","06112023-07:59:13","""ggm-"" properties worden beheerd in het GGM informatiemodel","1b771d9e-6208-4916-86ed-a88a79cac648","https://redactie.gemmaonline.nl/index.php/GEMMA2/0.9/id-6f15e2ca-531d-4879-b087-f43559d8c3fd",,,"BRK",
"/Business/_Sync GEMMA en project/GGM/Bedrijfsobjecten/","Erfgoed Object","business-object","Uit het verleden ge√´rfde materi√´le en immateri√´le objecten","id-73f341fd52d140e2bca31e31ba7ef831","{71A5C565-C2CC-495f-910A-76C199C6AF0E}","Class","06112023-07:59:13","""ggm-"" properties worden beheerd in het GGM informatiemodel","9d218c7e-64e5-45e1-9bac-ec9f27d50fe3","https://redactie.gemmaonline.nl/index.php/GEMMA2/0.9/id-6f15e2ca-531d-4879-b087-f43559d8c3fd",,,,"Museumobject, Archiefstuk"
"/Business/_Sync GEMMA en project/GGM/Bedrijfsobjecten/","Zakelijk Recht","business-object","Geeft een recht op een goed, zoals een onroerende zaak of een roerende zaak.","id-758a8b662ced4246a696191c53ca2b6c","{8D52E9F1-9CC9-42c6-A347-E68E29718E55}","Class","06112023-07:59:13","""ggm-"" properties worden beheerd in het GGM informatiemodel","a6741440-a70f-4d05-b164-6a21b867b4d3","https://redactie.gemmaonline.nl/index.php/GEMMA2/0.9/id-6f15e2ca-531d-4879-b087-f43559d8c3fd",,"Zakelijk Recht (Vastgoed)",,
"/Business/_Sync GEMMA en project/GGM/Bedrijfsobjecten/","Rol","business-object","Een samenhangende set van taken, bevoegdheden en verantwoordelijkheden van een gebruiker.","id-75e1f25fc71440c2b7fa43b92c207aba","{78C6EB53-77EB-4e9a-B012-E9CD989BDD06}","Class","06112023-07:59:13","""ggm-"" properties worden beheerd in het GGM informatiemodel","f67c1bc6-2240-4c34-a008-f42cf551b005","https://redactie.gemmaonline.nl/index.php/GEMMA2/0.9/id-6f15e2ca-531d-4879-b087-f43559d8c3fd","Gebruikersrol",,,
"/Business/_Sync GEMMA en project/GGM/Bedrijfsobjecten/","Veld","business-object","Een stuk land dat speciaal voor het bedrijven van een veldsport gereedgemaakt is","id-77fb399749f046dd81c4938b462c3c03","{D1889096-CC76-48a8-A9DF-8151FFF1E0AC}","Class","06112023-07:59:13","""ggm-"" properties worden beheerd in het GGM informatiemodel","0f53081c-01f9-4c0a-b049-77d310a0ea33","https://redactie.gemmaonline.nl/index.php/GEMMA2/0.9/id-6f15e2ca-531d-4879-b087-f43559d8c3fd",,,,
"/Business/_Sync GEMMA en project/GGM/Bedrijfsobjecten/","Nadere Toegang","business-object","De bevoegdheid om gegevens te raadplegen, bepaalde plaatsen te betreden of een bepaalde taak uit te oefenen.","id-7829f355bdbb4639a84131ec2f3a8ee3","{7A080605-07C5-4947-9B35-BC6EBE2041FA}","Class","06112023-07:59:13","""ggm-"" properties worden beheerd in het GGM informatiemodel","b4652813-e293-416c-9ff0-c254fcd6fd83","https://redactie.gemmaonline.nl/index.php/GEMMA2/0.9/id-6f15e2ca-531d-4879-b087-f43559d8c3fd",,,,
"/Business/_Sync GEMMA en project/GGM/Bedrijfsobjecten/","Omgevingswaarde","business-object","Een norm die voor (een onderdeel van) de fysieke leefomgeving de gewenste staat of kwaliteit, de toelaatbare belasting door activiteiten en/of de toelaatbare concentratie of depositie van stoffen als beleidsdoel vastlegt.","id-791f2072e29b496288f4754dd4967ab1","{6B1F7274-19A7-4349-835E-85CBEFFEE35A}","Class","06112023-07:59:13","""ggm-"" properties worden beheerd in het GGM informatiemodel","7685ae20-7bed-4f7e-95fd-3499b35a6ef9","https://redactie.gemmaonline.nl/index.php/GEMMA2/0.9/id-6f15e2ca-531d-4879-b087-f43559d8c3fd",,,,
"/Business/_Sync GEMMA en project/GGM/Bedrijfsobjecten/","Subsidieaanvraag","business-object","Aanvraag voor een subsidie","id-792314de721f42e8af41390c41fa4ebe","{26C0D33A-B15A-4256-A5BF-5382A4E03539}","Class","06112023-07:59:13","""ggm-"" properties worden beheerd in het GGM informatiemodel","4e5cd8a8-0110-4038-9b91-1f0562401398","https://redactie.gemmaonline.nl/index.php/GEMMA2/0.9/id-6f15e2ca-531d-4879-b087-f43559d8c3fd",,,,
"/Business/_Sync GEMMA en project/GGM/Bedrijfsobjecten/","Sportmateriaal","business-object","Materieel om sport mee te beoefenen of ter odnersteuning van de sportuitvoering.","id-795936296fec4ef9926277c98d8ae779","{5B64A5F8-64B5-4d1b-BEDD-486ED2C2C493}","Class","06112023-07:59:13","""ggm-"" properties worden beheerd in het GGM informatiemodel","488958ee-08fd-4818-af8b-2d7ebb73c01f","https://redactie.gemmaonline.nl/index.php/GEMMA2/0.9/id-6f15e2ca-531d-4879-b087-f43559d8c3fd",,,,
"/Business/_Sync GEMMA en project/GGM/Bedrijfsobjecten/","Sollicitatiegesprek","business-object","Onderhoud tussen sollicitant en werkgever met betrekking tot een sollicatie","id-79a98ba6d007494d907777b8e5acd119","{1D4DA0E6-DA20-4ff7-A415-B937712C6F6D}","Class","06112023-07:59:13","""ggm-"" properties worden beheerd in het GGM informatiemodel","565033f9-9a69-4d65-ad37-f1d17ea3e937","https://redactie.gemmaonline.nl/index.php/GEMMA2/0.9/id-6f15e2ca-531d-4879-b087-f43559d8c3fd",,,,
"/Business/_Sync GEMMA en project/GGM/Bedrijfsobjecten/","Conclusie","business-object","Conclusie van de check. Antwoord op de vraag of ik een melding moet doen of een vergunning aan moet vragen voor een bepaalde activiteit.","id-7aab5d3df5c44a668fe85598e53a4008","{C2A7756C-87E9-44f0-85A9-673F3956BB48}","Class","06112023-07:59:13","""ggm-"" properties worden beheerd in het GGM informatiemodel","16995484-0391-40d1-99c3-2ba2292e276f","https://redactie.gemmaonline.nl/index.php/GEMMA2/0.9/id-6f15e2ca-531d-4879-b087-f43559d8c3fd",,,,
"/Business/_Sync GEMMA en project/GGM/Bedrijfsobjecten/","Mast","business-object","Draagconstructie, bestaande uit een verticale buispaal, die wordt gebruikt om iets op hoogte te brengen.","id-7acb8bcbab5145788896dec1bbd1e31b","{CDF116D4-B5B9-4D01-8A5B-4FFB08CEE00}","Class","06112023-07:59:13","""ggm-"" properties worden beheerd in het GGM informatiemodel","b3edfde2-4da1-47f8-96a0-54bc77c9900f","https://redactie.gemmaonline.nl/index.php/GEMMA2/0.9/id-6f15e2ca-531d-4879-b087-f43559d8c3fd",,,,
"/Business/_Sync GEMMA en project/GGM/Bedrijfsobjecten/","APPARTEMENTSRECHT","business-object","Een KADASTRALE ONROERENDE ZAAK dat een aandeel is in de 
goederen die in de splitsing zijn betrokken, dat de bevoegdheid omvat tot het uitsluitend gebruik van bepaalde gedeelten van het gebouw die blijkens hun inrichting bestemd zijn of worden om als afzonderlijk geheel te worden 
gebruikt (art. 5:106 lid 4 BW).","id-7b008d6ba9dc45ccb5789e76c398e4d2","{869E0A04-A663-4839-970D-7FB82DF6C317}","Class","06112023-07:59:13","""ggm-"" properties worden beheerd in het GGM informatiemodel","b84fbae7-cecd-4c24-96cb-427a00d862c6","https://redactie.gemmaonline.nl/index.php/GEMMA2/0.9/id-6f15e2ca-531d-4879-b087-f43559d8c3fd",,,"BRK",
"/Business/_Sync GEMMA en project/GGM/Bedrijfsobjecten/","Lener","business-object","Iemand die iets te leen krijgt, met name iemand die boeken, digitale bestanden of apparatuur leent bij een museum, bibliotheek, mediatheek of een andere uitleeninstantie","id-7b195da29b46480b842b0b7a082cd08a","{68C42EEA-6985-483e-99E6-E0F1FB71D622}","Class","06112023-07:59:13","""ggm-"" properties worden beheerd in het GGM informatiemodel","40c57f7c-2356-4c05-b22d-a2a8466dfebd","https://redactie.gemmaonline.nl/index.php/GEMMA2/0.9/id-6f15e2ca-531d-4879-b087-f43559d8c3fd",,,,
"/Business/_Sync GEMMA en project/GGM/Bedrijfsobjecten/","Verlichtingsobject","business-object","Paal of mast waaraan openbare verlichting is bevestigd.","id-7b4dc222d7d445afaabfd7e89f55969c","{8CD4C799-C403-41B6-B409-06D37398E31}","Class","06112023-07:59:13","""ggm-"" properties worden beheerd in het GGM informatiemodel","95a78138-3227-48e1-8499-4bcbba4ab13c","https://redactie.gemmaonline.nl/index.php/GEMMA2/0.9/id-6f15e2ca-531d-4879-b087-f43559d8c3fd",,,,
"/Business/_Sync GEMMA en project/GGM/Bedrijfsobjecten/","Onbestemd Adres","business-object","","id-7d31688eee4d48f3b13c0a97496a34d8","{75E93FC5-3EF8-40b6-B170-ED5A2C36B354}","Class","06112023-07:59:13","""ggm-"" properties worden beheerd in het GGM informatiemodel","ced72a4a-9aa5-485a-8535-206b97fd494f","https://redactie.gemmaonline.nl/index.php/GEMMA2/0.9/id-6f15e2ca-531d-4879-b087-f43559d8c3fd",,,,
"/Business/_Sync GEMMA en project/GGM/Bedrijfsobjecten/","NATIONALITEIT","business-object","De hoedanigheid van tot een bepaalde natie te behoren.","id-7de066e2109a4021af98256783d70525","{71B3BE0D-2BF9-4740-9597-A0EEC75AFE9B}","Class","06112023-07:59:13","""ggm-"" properties worden beheerd in het GGM informatiemodel","307ed7bc-827c-4151-8ea3-df45444862f8","https://redactie.gemmaonline.nl/index.php/GEMMA2/0.9/id-6f15e2ca-531d-4879-b087-f43559d8c3fd",,,,
"/Business/_Sync GEMMA en project/GGM/Bedrijfsobjecten/","WOONPLAATS","business-object","Een door het bevoegde gemeentelijke orgaan als zodanig aangewezen en van een naam voorzien gedeelte van het grondgebied van de gemeente.","id-7ea590485bf04be596da094ae46756d6","{039AFF88-F5F7-4c1a-B7E4-1BDFC495F67A}","Class","06112023-07:59:13","""ggm-"" properties worden beheerd in het GGM informatiemodel","c063970e-27f6-45a2-88e8-0105dbbce716","https://redactie.gemmaonline.nl/index.php/GEMMA2/0.9/id-6f15e2ca-531d-4879-b087-f43559d8c3fd",,"WOONPLAATS (RSGB Model)","BAG",
"/Business/_Sync GEMMA en project/GGM/Bedrijfsobjecten/","Hotelbezoek","business-object","Verblijf in een hotel","id-7eeeb836eb264994a2f1b97be6543a30","{669000E9-25D6-4346-B718-516CDB8B88B7}","Class","06112023-07:59:13","""ggm-"" properties worden beheerd in het GGM informatiemodel","b8e61a1f-ed19-4cd3-b873-0fe7d85beb9b","https://redactie.gemmaonline.nl/index.php/GEMMA2/0.9/id-6f15e2ca-531d-4879-b087-f43559d8c3fd",,,,
"/Business/_Sync GEMMA en project/GGM/Bedrijfsobjecten/","Vastgoedcontractregel","business-object","ONderdeel van een vastgoedcontract","id-7f1fade2b48f4d469e1a768a27b990ab","{1C25D70B-AE22-4654-9190-2F55272D9BE6}","Class","06112023-07:59:13","""ggm-"" properties worden beheerd in het GGM informatiemodel","cd39bcc5-b77a-41f8-8815-e8076696f48d","https://redactie.gemmaonline.nl/index.php/GEMMA2/0.9/id-6f15e2ca-531d-4879-b087-f43559d8c3fd",,,,
"/Business/_Sync GEMMA en project/GGM/Bedrijfsobjecten/","Inschrijving","business-object","Inschrijving op een nationale of Europese aanbesteding","id-8039c01ddd174091ba3eda0f88b40779","{2902E8D6-FF16-45d6-A0A4-47E2857D2D19}","Class","06112023-07:59:13","""ggm-"" properties worden beheerd in het GGM informatiemodel","e1c425c1-a3fe-4144-907d-13da8d9fb5cc","https://redactie.gemmaonline.nl/index.php/GEMMA2/0.9/id-6f15e2ca-531d-4879-b087-f43559d8c3fd",,"Inschrijving (Inkoop)",,
"/Business/_Sync GEMMA en project/GGM/Bedrijfsobjecten/","Put","business-object","Grondspoor, veelal verstevigd en gefundeerd aangelegd, bedoeld voor de tijdelijke opslag van danwel water (waterput) danwel uitwerpselen en afval (beerput).","id-806fefacd4ba46188c31db1b91a24b1c","{17286CE1-21F2-454b-95A6-3E4C0C6E2453}","Class","06112023-07:59:13","""ggm-"" properties worden beheerd in het GGM informatiemodel","6ace770c-ac42-4d79-bd84-145f77968360","https://redactie.gemmaonline.nl/index.php/GEMMA2/0.9/id-6f15e2ca-531d-4879-b087-f43559d8c3fd",,"Put (Archeologie)",,
"/Business/_Sync GEMMA en project/GGM/Bedrijfsobjecten/","GEMEENTE","business-object","Een gedeelte van het grondgebied van Nederland, ingesteld op basis van artikel 123 van de Grondwet.","id-808830e013014a09852f5f4723053f95","{B0D9792B-46E7-4b88-B267-C72691616733}","Class","06112023-07:59:13","""ggm-"" properties worden beheerd in het GGM informatiemodel","9f1ea854-eb45-47a0-98f4-4043b4a69be0","https://redactie.gemmaonline.nl/index.php/GEMMA2/0.9/id-6f15e2ca-531d-4879-b087-f43559d8c3fd",,"GEMEENTE (RSGB Model)","Door KING toegevoegd objecttype, ontleend aan het GFO BG (maakt geen deel uit van enige basisregistratie).",
"/Business/_Sync GEMMA en project/GGM/Bedrijfsobjecten/","Schouwronde","business-object","Activiteit om te controleren of de opdrachtnemer aan de afspraken voldoet.","id-81f0adc6814d4c01ab55b579b5afe6a8","{B011D584-1E66-4a21-A9C4-C922A8763AB2}","Class","06112023-07:59:13","""ggm-"" properties worden beheerd in het GGM informatiemodel","0a945e86-b4f2-45b2-855f-ed9fd0b4dca1","https://redactie.gemmaonline.nl/index.php/GEMMA2/0.9/id-6f15e2ca-531d-4879-b087-f43559d8c3fd",,,,
"/Business/_Sync GEMMA en project/GGM/Bedrijfsobjecten/","Aanvraag Inkooporder","business-object","het betreft hier het formulier 'Aanvraag Inkooporder'","id-821c84aa4ebc4e328dd282957b71ac6d","{33E5EA10-F43A-4966-B9C1-875F0E2C1B52}","Class","06112023-07:59:13","""ggm-"" properties worden beheerd in het GGM informatiemodel","8d9233d7-dfb9-4b87-bab2-61631a632f95","https://redactie.gemmaonline.nl/index.php/GEMMA2/0.9/id-6f15e2ca-531d-4879-b087-f43559d8c3fd",,,,
"/Business/_Sync GEMMA en project/GGM/Bedrijfsobjecten/","Gebruiksdoel","business-object","Een aanduiding va alle waarden waarmee het gebruiksdoel van een object kan worden verbijzonderd.","id-83327a6fa82c47e9be1136b8c66ea052","{A5975EF7-558A-44fa-A656-AB43580D8C35}","Class","06112023-07:59:13","""ggm-"" properties worden beheerd in het GGM informatiemodel","507292ba-1a0c-4ebf-b696-fc2c5ce1910e","https://redactie.gemmaonline.nl/index.php/GEMMA2/0.9/id-6f15e2ca-531d-4879-b087-f43559d8c3fd",,,,
"/Business/_Sync GEMMA en project/GGM/Bedrijfsobjecten/","Auteur","business-object","De persoon die verantwoordelijk is voor de inhoud van een (digitaal) document","id-83ac44f0a0904892b993d1ab22a6ab16","{BCAFBBCD-851E-4235-9D85-88EC71F2245B}","Class","06112023-07:59:13","""ggm-"" properties worden beheerd in het GGM informatiemodel","3335a028-e7f5-44a7-9afc-a80ba0214eb6","https://redactie.gemmaonline.nl/index.php/GEMMA2/0.9/id-6f15e2ca-531d-4879-b087-f43559d8c3fd",,,,
"/Business/_Sync GEMMA en project/GGM/Bedrijfsobjecten/","HALT-verwijzing","business-object","Jongeren van 12 tot 18 jaar die strafbare feiten plegen, zoals bijvoorbeeld: winkeldiefstal, vernieling, openbaar dronkenschap of oplichting kunnen naar Halt worden verwezen. In sommige gevallen is daarvoor toestemming nodig van het Openbaar Ministerie.","id-840ed13c0b8b471b9eb27161c2d5cf30","{70E3C6AF-1117-4cfc-B61F-0D168010FFB9}","Class","06112023-07:59:13","""ggm-"" properties worden beheerd in het GGM informatiemodel","1bd77fef-f3da-40cc-b94f-e325b0781719","https://redactie.gemmaonline.nl/index.php/GEMMA2/0.9/id-6f15e2ca-531d-4879-b087-f43559d8c3fd",,,,
"/Business/_Sync GEMMA en project/GGM/Bedrijfsobjecten/","MOOR-melding","business-object","Meldingsproces rondom werkzaamheden aan kabels en leidingen.","id-841194050deb422ab998a5173772f82d","{30D5F6E6-DE8D-46b6-AC8A-6CA1391ADFF7}","Class","06112023-07:59:13","""ggm-"" properties worden beheerd in het GGM informatiemodel","4e149a77-4fcc-4f4a-ac18-b6655848b5c1","https://redactie.gemmaonline.nl/index.php/GEMMA2/0.9/id-6f15e2ca-531d-4879-b087-f43559d8c3fd",,,,
"/Business/_Sync GEMMA en project/GGM/Bedrijfsobjecten/","Bouwactiviteit","business-object","Het bouwen van een bouwwerk.","id-8467fc6067cf48d79e92a3ad177d3143","{4AD539EC-A308-43da-B025-17A1647303F3}","Class","06112023-07:59:13","""ggm-"" properties worden beheerd in het GGM informatiemodel","2b2319c1-d5b9-43c6-87cb-43bb194c65c6","https://redactie.gemmaonline.nl/index.php/GEMMA2/0.9/id-6f15e2ca-531d-4879-b087-f43559d8c3fd",,,,
