"folder","name","type","documentation","id","ggm-guid","ggm-uml-type","ggm-datum-tijd-export","Let op","Object ID","GEMMA URL","synoniemen","alternate name","bron","Meer specifiek"
"/Business/_Sync GEMMA en project/GGM/Bedrijfsobjecten/","Ouder Of Verzorger","business-object","","id-a08ae2f00af04a1cbb634d17cdbc4925","{51C8E3DF-FFF4-4a20-9CB2-AA5FA50579E2}","Class","06112023-07:59:13","""ggm-"" properties worden beheerd in het GGM informatiemodel","91982611-d658-4c52-8869-0bbf87b487d3","https://redactie.gemmaonline.nl/index.php/GEMMA2/0.9/id-6f15e2ca-531d-4879-b087-f43559d8c3fd",,,,
"/Business/_Sync GEMMA en project/GGM/Bedrijfsobjecten/","Locatie","business-object","Locaties die worden aangedaan tijdens het rijden van een route. Dit kunnen adressen zijn en/of GML-punten met een x- en y-coordinaat. Avalex hanteert op het moment van schrijven alleen adressen, ook voor de containers.","id-a0d0650156a6427f92c1c828d4990438","{7F4E17A3-0EC2-4bee-B4E0-BFA26D653EB9}","Class","06112023-07:59:13","""ggm-"" properties worden beheerd in het GGM informatiemodel","71b8f8f4-9789-4cab-9828-d508607188bf","https://redactie.gemmaonline.nl/index.php/GEMMA2/0.9/id-6f15e2ca-531d-4879-b087-f43559d8c3fd",,"Locatie (Afval)",,
"/Business/_Sync GEMMA en project/GGM/Bedrijfsobjecten/","Domein/Taakveld","business-object","Kennisgebied of activiteit gekarakteriseerd door een verzameling van concepten, begrippen en/of waarden","id-a133e82d42224d108adfce21c8025437","{BEFEC56A-EF6C-49f0-9368-7E46F75D9562}","Class","06112023-07:59:13","""ggm-"" properties worden beheerd in het GGM informatiemodel","a6ea9d59-4ac3-4aca-ba3f-1b52e741b56b","https://redactie.gemmaonline.nl/index.php/GEMMA2/0.9/id-6f15e2ca-531d-4879-b087-f43559d8c3fd",,,,
"/Business/_Sync GEMMA en project/GGM/Bedrijfsobjecten/","Onderwijsloopbaan","business-object","Loopbaan als leerling in het onderwijs; loopbaan als leerling op school; tijd die iemand als leerling heeft doorgebracht op school, vaak met de bijgedachte aan de daarbij opgedane kennis en ervaring; tijd die men schoolgegaan heeft; onderwijscarri√®re; schoolloopbaan; schoolcarri√®re; schooltijd; de schooljaren","id-a196e7830db243069b2b25ebc74604f9","{F47ACE79-C476-479f-A3A3-729E65AF3D32}","Class","06112023-07:59:13","""ggm-"" properties worden beheerd in het GGM informatiemodel","153ea543-3a96-4878-b661-f7c3d0f07d20","https://redactie.gemmaonline.nl/index.php/GEMMA2/0.9/id-6f15e2ca-531d-4879-b087-f43559d8c3fd",,,,
"/Business/_Sync GEMMA en project/GGM/Bedrijfsobjecten/","MJOP","business-object","Meerjaren Onderhoudsplanning","id-a19dc316cff24ec9b6714981b15c4214","{A110896B-0CAD-46cf-9226-840DEE3328F0}","Class","06112023-07:59:13","""ggm-"" properties worden beheerd in het GGM informatiemodel","e1be07bf-e9fb-488e-9b03-785b44167e43","https://redactie.gemmaonline.nl/index.php/GEMMA2/0.9/id-6f15e2ca-531d-4879-b087-f43559d8c3fd",,,,
"/Business/_Sync GEMMA en project/GGM/Bedrijfsobjecten/","Resultaat","business-object","De uitkomst van iets, bijvoorbeeld een berekening of een onderzoek. een gevolg.","id-a19e8c538f10410ea2e9489acb0703f4","{253EF837-860B-438e-9157-6E1E07CB6F68}","Class","06112023-07:59:13","""ggm-"" properties worden beheerd in het GGM informatiemodel","575ac733-b713-457e-8798-0e188c9fc8fd","https://redactie.gemmaonline.nl/index.php/GEMMA2/0.9/id-6f15e2ca-531d-4879-b087-f43559d8c3fd",,,,
"/Business/_Sync GEMMA en project/GGM/Bedrijfsobjecten/","REDEN VERKRIJGING NATIONALITEIT","business-object","Tabel waarin de redenen staan voor opname van de Nederlandse nationaliteit.","id-a20441dd60b54c4584183fc0d584757e","{61D1E99C-DF5E-48ee-8BAB-4ACA1745BC7C}","Class","06112023-07:59:13","""ggm-"" properties worden beheerd in het GGM informatiemodel","bf1e6259-da1b-4781-8b19-77b8b7dbe884","https://redactie.gemmaonline.nl/index.php/GEMMA2/0.9/id-6f15e2ca-531d-4879-b087-f43559d8c3fd",,,"BRP",
"/Business/_Sync GEMMA en project/GGM/Bedrijfsobjecten/","Aanstelling","business-object","De rechtsbetrekking tussen werkgever en werknemer zoals vastgelegd in een arbeidsovereenkomst.","id-a30095c6b7b044f2a0bcc03dc5ee4b74","{F95E3068-5FAA-47a4-995F-5B9ADF2FA2C7}","Class","06112023-07:59:13","""ggm-"" properties worden beheerd in het GGM informatiemodel","351d8685-5a54-4926-b6b4-9c855acceab8","https://redactie.gemmaonline.nl/index.php/GEMMA2/0.9/id-6f15e2ca-531d-4879-b087-f43559d8c3fd","Dienstverband",,,
"/Business/_Sync GEMMA en project/GGM/Bedrijfsobjecten/","Historische Rol","business-object","Rol waarvan informatie beschikbaar is uit het verleden.","id-a3046dd30c744e18abb6e242e95ab60f","{4A1697B7-534B-4dc2-A5A2-8C13E7DA24B2}","Class","06112023-07:59:13","""ggm-"" properties worden beheerd in het GGM informatiemodel","03179e7a-0179-461d-8028-bdb5a34d8f1d","https://redactie.gemmaonline.nl/index.php/GEMMA2/0.9/id-6f15e2ca-531d-4879-b087-f43559d8c3fd",,,,
"/Business/_Sync GEMMA en project/GGM/Bedrijfsobjecten/","Tegenprestatie","business-object","Verplichting die tegenover een prestatie staat","id-a33396f1b4284be0ab30c92042a368f3","{B3F6F6D2-5054-484d-A0C4-A95EF6FA5AD2}","Class","06112023-07:59:13","""ggm-"" properties worden beheerd in het GGM informatiemodel","8b15e4a4-11fb-42f3-b7e8-29192dbfc19a","https://redactie.gemmaonline.nl/index.php/GEMMA2/0.9/id-6f15e2ca-531d-4879-b087-f43559d8c3fd",,,,
"/Business/_Sync GEMMA en project/GGM/Bedrijfsobjecten/","Tunnelobject","business-object","Onderdeel van een kunstmatig aangelegde, kokervormige onderdoorgang dat essentieel is voor de constructie.","id-a358076f88d04bd597835ea3c4f543c4","{906C9BA6-762D-4B15-94A3-6D8F2D8B922}","Class","06112023-07:59:13","""ggm-"" properties worden beheerd in het GGM informatiemodel","1759a15a-e759-4abc-9fbb-1bd85bea382c","https://redactie.gemmaonline.nl/index.php/GEMMA2/0.9/id-6f15e2ca-531d-4879-b087-f43559d8c3fd",,,,
"/Business/_Sync GEMMA en project/GGM/Bedrijfsobjecten/","Heffinggrondslag","business-object","De maatstaf waarop een belasting is gebaseerd, het bedrag op basis waarvan een bepaalde belasting wordt geheven of de premie voor sociale zekerheid wordt vastgesteld.","id-a3b8400e391e44d8a396920770a73800","{3D2D5426-653C-485c-A99C-8AD933E76D78}","Class","06112023-07:59:13","""ggm-"" properties worden beheerd in het GGM informatiemodel","654000c4-9d8b-4453-b3e8-4f77fb1b15a2","https://redactie.gemmaonline.nl/index.php/GEMMA2/0.9/id-6f15e2ca-531d-4879-b087-f43559d8c3fd",,,,
"/Business/_Sync GEMMA en project/GGM/Bedrijfsobjecten/","Leiding","business-object","Een geheel van geleiders welke voorzien zijn van Ã©Ã©n ommanteling en bestemd is voor transport van materie GWSW","id-a4b836b467284876a98be532cdab7a4e","{4223240C-8786-4D44-889E-9F54BA39A83}","Class","06112023-07:59:13","""ggm-"" properties worden beheerd in het GGM informatiemodel","b2bdb817-4007-4c1b-ad24-43929884e0eb","https://redactie.gemmaonline.nl/index.php/GEMMA2/0.9/id-6f15e2ca-531d-4879-b087-f43559d8c3fd",,,,
"/Business/_Sync GEMMA en project/GGM/Bedrijfsobjecten/","Doorgeleiding OM","business-object","","id-a4cae05408a04b6496945bc05fd50638","{90E49701-2A06-4669-9199-6FCFDFCA707A}","Class","06112023-07:59:13","""ggm-"" properties worden beheerd in het GGM informatiemodel","341c4296-ac61-426e-b1d8-668052c53ea9","https://redactie.gemmaonline.nl/index.php/GEMMA2/0.9/id-6f15e2ca-531d-4879-b087-f43559d8c3fd",,,,
"/Business/_Sync GEMMA en project/GGM/Bedrijfsobjecten/","Huishouden","business-object","persoon of groep personen die een huishouden voert waarbij sprake is van een onderlinge verbondenheid en continu√Øteit in de samenstelling ervan, die binnen een woning gebruik maakt van dezelfde voorzieningen","id-a66e850814b84cff862654fc3d6421dd","{F0467610-553B-47cd-A9F7-3B1D20CC425E}","Class","06112023-07:59:13","""ggm-"" properties worden beheerd in het GGM informatiemodel","ffca91bc-ed2b-4885-9e04-7a459fd67cad","https://redactie.gemmaonline.nl/index.php/GEMMA2/0.9/id-6f15e2ca-531d-4879-b087-f43559d8c3fd",,"Huishouden (Generiek Jeugd en Wmo)",,
"/Business/_Sync GEMMA en project/GGM/Bedrijfsobjecten/","MAP","business-object","","id-a6ed11766942490ea4dd5abf59e55feb","{2177E7F0-0F76-41b7-B5CA-5FE182355E94}","Class","06112023-07:59:13","""ggm-"" properties worden beheerd in het GGM informatiemodel","25fe4f05-5edf-451d-9c67-1dd286a162af","https://redactie.gemmaonline.nl/index.php/GEMMA2/0.9/id-6f15e2ca-531d-4879-b087-f43559d8c3fd",,,,
"/Business/_Sync GEMMA en project/GGM/Bedrijfsobjecten/","Container","business-object","Container voor het gescheiden inzamelen van huishoudelijke afvalstoffen dwz afvalstoffen afkomstig uit particuliere huishoudens behoudens voor zover het ingezamelde bestanddelen van die afvalstoffen betreft die zijn aangewezen als gevaarlijke afvalstoffen","id-a6ff7ae28f0e4fd7808697cddcb731b5","{7D3D98F0-664C-4605-9D95-F68C88ECBA9A}","Class","06112023-07:59:13","""ggm-"" properties worden beheerd in het GGM informatiemodel","a9b50546-d72d-4e60-8da5-184a27a626c5","https://redactie.gemmaonline.nl/index.php/GEMMA2/0.9/id-6f15e2ca-531d-4879-b087-f43559d8c3fd",,,,
"/Business/_Sync GEMMA en project/GGM/Bedrijfsobjecten/","Examen","business-object","","id-a7336a6bf42f45cd85cc25d06a7f7939","{DCE46ABA-613D-4204-86F4-35F517FF680F}","Class","06112023-07:59:13","""ggm-"" properties worden beheerd in het GGM informatiemodel","ccce5500-2140-4928-9716-0132a31e9686","https://redactie.gemmaonline.nl/index.php/GEMMA2/0.9/id-6f15e2ca-531d-4879-b087-f43559d8c3fd",,,,
"/Business/_Sync GEMMA en project/GGM/Bedrijfsobjecten/","Uitgever","business-object","Iemand die iets op de markt brengt; iemand die iets uitgeeft","id-a85372b7889b421cb793511690aceebe","{59CF7225-3D61-42e2-A399-7EB13450D97D}","Class","06112023-07:59:13","""ggm-"" properties worden beheerd in het GGM informatiemodel","0d7e9bb5-b865-4599-aa6d-6cac9fd2185b","https://redactie.gemmaonline.nl/index.php/GEMMA2/0.9/id-6f15e2ca-531d-4879-b087-f43559d8c3fd",,,,
"/Business/_Sync GEMMA en project/GGM/Bedrijfsobjecten/","Parkeervergunning","business-object","Offici√´le toestemming dat je op een bepaalde plek mag parkeren","id-a8bd611cb4db419f9c344681f53242f3","{FF448272-AB9D-4ec9-B4BE-E60E2552817A}","Class","06112023-07:59:13","""ggm-"" properties worden beheerd in het GGM informatiemodel","1486de79-ad71-4dce-8473-f23f1e9c436c","https://redactie.gemmaonline.nl/index.php/GEMMA2/0.9/id-6f15e2ca-531d-4879-b087-f43559d8c3fd",,,,
"/Business/_Sync GEMMA en project/GGM/Bedrijfsobjecten/","Leerroute","business-object","","id-a93f5d5b1c924998b8614eff510d2842","{51285531-9529-4b2d-9EC6-B6BAEA729D9A}","Class","06112023-07:59:13","""ggm-"" properties worden beheerd in het GGM informatiemodel","ab441c2e-d5a6-4546-b1b8-a08d3bee1c07","https://redactie.gemmaonline.nl/index.php/GEMMA2/0.9/id-6f15e2ca-531d-4879-b087-f43559d8c3fd",,,,"Z, Onderwijs, B1"
"/Business/_Sync GEMMA en project/GGM/Bedrijfsobjecten/","WOZ-DEELOBJECT","business-object","Aanduiding van afzonderlijke elementen (delen van het object, bijzondere waarderelevante factoren) die voor de onderbouwing van de vastgestelde waarde van belang zijn.","id-aa634b77b2d248c1ad23fdf96152a0d6","{EEC30588-0E12-41c9-977E-C885A0A7EDC3}","Class","06112023-07:59:13","""ggm-"" properties worden beheerd in het GGM informatiemodel","8047febd-3ee4-4a35-83ce-5f538c607446","https://redactie.gemmaonline.nl/index.php/GEMMA2/0.9/id-6f15e2ca-531d-4879-b087-f43559d8c3fd",,,"Gegevenswoordenboek WOZ",
"/Business/_Sync GEMMA en project/GGM/Bedrijfsobjecten/","KADASTRAAL PERCEEL","business-object","Een KADASTRALE ONROERENDE ZAAK dat een kadastraal geïdentificeerd en met kadastrale grenzen begrensd deel van het Nederlands grondgebied betreft (art. 1 lid 1 Kadasterwet).","id-acd7590e682f4c53af9bef2e949b0d50","{172AFD36-B400-4660-BFAC-4BBC1077D666}","Class","06112023-07:59:13","""ggm-"" properties worden beheerd in het GGM informatiemodel","0fd3695d-aa71-4f35-a8bf-7886c70e0ed8","https://redactie.gemmaonline.nl/index.php/GEMMA2/0.9/id-6f15e2ca-531d-4879-b087-f43559d8c3fd",,,"BRK.",
"/Business/_Sync GEMMA en project/GGM/Bedrijfsobjecten/","Aanvraagdata","business-object","Bron: GEN_REQ_DATA
ID: REQ_DATA icm VELD_NAAM","id-acfde1792c1640338aa2a9a9c46b3d33","{1F68C981-7E16-4368-8867-CA00AEB08A04}","Class","06112023-07:59:13","""ggm-"" properties worden beheerd in het GGM informatiemodel","6f15e2ca-531d-4879-b087-f43559d8c3fd","https://redactie.gemmaonline.nl/index.php/GEMMA2/0.9/id-6f15e2ca-531d-4879-b087-f43559d8c3fd",,,,
"/Business/_Sync GEMMA en project/GGM/Bedrijfsobjecten/","Bezetting","business-object","Aantal deelnemers aan een activiteit","id-ad364b23c4654f5c87d26ff2c951edef","{D9F56210-BF72-42e4-A1BC-AD7F683D55A0}","Class","06112023-07:59:13","""ggm-"" properties worden beheerd in het GGM informatiemodel","f79e21a0-261c-4897-822c-d376a4cc0629","https://redactie.gemmaonline.nl/index.php/GEMMA2/0.9/id-6f15e2ca-531d-4879-b087-f43559d8c3fd",,,,
"/Business/_Sync GEMMA en project/GGM/Bedrijfsobjecten/","Verhardingsobject","business-object","Verharde lagen van een weglichaam, speel- en sportondergronden en onbegroeid terreindelen inclusief de fundering.","id-aea6af5545f0476daa327935805c16ac","{47F12418-C5F8-44E0-8EC6-3D0C5993372}","Class","06112023-07:59:13","""ggm-"" properties worden beheerd in het GGM informatiemodel","a1a1d3ab-366d-4395-be52-b8d918614585","https://redactie.gemmaonline.nl/index.php/GEMMA2/0.9/id-6f15e2ca-531d-4879-b087-f43559d8c3fd",,,,
"/Business/_Sync GEMMA en project/GGM/Bedrijfsobjecten/","Notariele Status","business-object","","id-af1b9f754f7f4cb6bef06a634e9c8a51","{9748A1E1-0B37-493d-B294-ED6CDE4C8DE9}","Class","06112023-07:59:13","""ggm-"" properties worden beheerd in het GGM informatiemodel","d72d1617-82d1-4241-97d7-46b14fbd6480","https://redactie.gemmaonline.nl/index.php/GEMMA2/0.9/id-6f15e2ca-531d-4879-b087-f43559d8c3fd",,,,
"/Business/_Sync GEMMA en project/GGM/Bedrijfsobjecten/","Parkeervlak","business-object","Parkeergelegenheid bestemd voor het parkeren van √©√©n of meerdere voertuigen direct langs de doorgaande weg gelegen.","id-af8dbdbdae3743788e83aa162e43f0ab","{5E5C58AD-1634-4656-A183-EBA00F18F30E}","Class","06112023-07:59:13","""ggm-"" properties worden beheerd in het GGM informatiemodel","30d7e3ac-081c-4ef6-a09e-90437b5a4349","https://redactie.gemmaonline.nl/index.php/GEMMA2/0.9/id-6f15e2ca-531d-4879-b087-f43559d8c3fd",,,,
"/Business/_Sync GEMMA en project/GGM/Bedrijfsobjecten/","PVT","business-object","","id-b01576f0af9e4090bbba70b1f51f05b4","{783B026E-E993-467c-85E0-E90E9E01BAA0}","Class","06112023-07:59:13","""ggm-"" properties worden beheerd in het GGM informatiemodel","b48d2c3e-646e-4858-b98a-b776f949cd8f","https://redactie.gemmaonline.nl/index.php/GEMMA2/0.9/id-6f15e2ca-531d-4879-b087-f43559d8c3fd",,,,
"/Business/_Sync GEMMA en project/GGM/Bedrijfsobjecten/","Uitvoeringsregel","business-object","De uitvoeringsregels bepalen hoe de benodigde gegevens (input data) wordt uitgevraagd. Dit kan op verschillende manieren gebeuren zoals een vraag aan een initiatiefnemer of een bevraging van een registratie.","id-b16ebeaeef8f48c98bcd9f3263cb17e3","{1528D03C-4F22-4d6b-A44F-605802C195C4}","Class","06112023-07:59:13","""ggm-"" properties worden beheerd in het GGM informatiemodel","0833a871-2597-43ea-90e9-a0c4b5f53572","https://redactie.gemmaonline.nl/index.php/GEMMA2/0.9/id-6f15e2ca-531d-4879-b087-f43559d8c3fd",,,,
"/Business/_Sync GEMMA en project/GGM/Bedrijfsobjecten/","Vondst","business-object","Overblijfsel, voorwerp of ander spoor van menselijke aanwezigheid in het verleden afkomstig van een archeologisch monument","id-b1799bb473ab4e0b90466d1a84157d85","{F8283401-70F8-41b8-A97C-32A9074AD4B1}","Class","06112023-07:59:13","""ggm-"" properties worden beheerd in het GGM informatiemodel","fc805177-e231-40eb-8f59-0fb3bdc896a1","https://redactie.gemmaonline.nl/index.php/GEMMA2/0.9/id-6f15e2ca-531d-4879-b087-f43559d8c3fd","Archeologische vondst",,,
"/Business/_Sync GEMMA en project/GGM/Bedrijfsobjecten/","Werkorder","business-object","Opdracht voor de uitvoering van een activiteit of een stap in een proces.","id-b19cbd61d2d14b9799f84e79075ad12c","{4AF7FA48-DFB0-474f-B797-A13D5FD37530}","Class","06112023-07:59:13","""ggm-"" properties worden beheerd in het GGM informatiemodel","5029f2d1-bad6-4813-8f59-d3f7981849e3","https://redactie.gemmaonline.nl/index.php/GEMMA2/0.9/id-6f15e2ca-531d-4879-b087-f43559d8c3fd",,,,
"/Business/_Sync GEMMA en project/GGM/Bedrijfsobjecten/","Kaart","business-object","De geografische weergave van een gedeelte van het aardoppervlak","id-b261cb831cc24f6b812f55d1bf153858","{F28DDE36-7BE4-45f7-A820-FFF0261CAA4E}","Class","06112023-07:59:13","""ggm-"" properties worden beheerd in het GGM informatiemodel","21a5d5b7-69f0-4501-98db-0655c44136b1","https://redactie.gemmaonline.nl/index.php/GEMMA2/0.9/id-6f15e2ca-531d-4879-b087-f43559d8c3fd",,,,
"/Business/_Sync GEMMA en project/GGM/Bedrijfsobjecten/","Opleiding","business-object","Een samenhangend geheel van vakken, gericht op de verwezenlijking van welomschreven doelstellingen op het gebied van kennis, inzicht en vaardigheden.","id-b31ec7e5bfaf47edac21822ef0432c15","{E07D60DE-CD26-4cef-A18B-6F72CC76C1B6}","Class","06112023-07:59:13","""ggm-"" properties worden beheerd in het GGM informatiemodel","affa85b2-1e80-4642-bb30-335dd9677094","https://redactie.gemmaonline.nl/index.php/GEMMA2/0.9/id-6f15e2ca-531d-4879-b087-f43559d8c3fd",,,,
"/Business/_Sync GEMMA en project/GGM/Bedrijfsobjecten/","Activiteit","business-object","Ieder menselijk handelen waarbij, of ieder menselijk nalaten waardoor een verandering of effect in de (fysieke) leefomgeving wordt of kan worden bewerkstelligd.","id-b4043e1cd49d4f0ebd518240d88be218","{8BE600D0-EBF4-475b-8801-F387A5D39009}","Class","06112023-07:59:13","""ggm-"" properties worden beheerd in het GGM informatiemodel","8deec5da-a06a-4159-9b20-e9f9ff24674e","https://redactie.gemmaonline.nl/index.php/GEMMA2/0.9/id-6f15e2ca-531d-4879-b087-f43559d8c3fd",,"Activiteit (Omgevingswet)",,
"/Business/_Sync GEMMA en project/GGM/Bedrijfsobjecten/","Periode","business-object","bepaalde tijdsduur.","id-b40b567a0b2b42fc9a12177e11128dcd","{137DECB4-F249-4039-B4F3-787852C4CB11}","Class","06112023-07:59:13","""ggm-"" properties worden beheerd in het GGM informatiemodel","fd2221c7-0cf4-47e1-a313-ec476a6592da","https://redactie.gemmaonline.nl/index.php/GEMMA2/0.9/id-6f15e2ca-531d-4879-b087-f43559d8c3fd",,,,
"/Business/_Sync GEMMA en project/GGM/Bedrijfsobjecten/","Plan","business-object","Project waarin woningen worden gerealiseerd","id-b455d96b92c24281af36125e8a29f3c3","{D857E285-1EA3-4ba3-9614-5FACAC8BA133}","Class","06112023-07:59:13","""ggm-"" properties worden beheerd in het GGM informatiemodel","e5933d4f-02b6-4851-a31e-8bc5b7cbaab6","https://redactie.gemmaonline.nl/index.php/GEMMA2/0.9/id-6f15e2ca-531d-4879-b087-f43559d8c3fd",,,,
"/Business/_Sync GEMMA en project/GGM/Bedrijfsobjecten/","Individueel Keuzebudget","business-object","Bedrag dat feitelijk beschikbaar gesteld wordt voor een individu om een bepaalde keus te kunnen maken","id-b5cd0ee86591471aae9a6a065d695fce","{B64178F1-7D37-4a77-BEF7-97E8C9DDA4E8}","Class","06112023-07:59:13","""ggm-"" properties worden beheerd in het GGM informatiemodel","3272f8ca-9302-4da5-810b-7b8c4d02d79b","https://redactie.gemmaonline.nl/index.php/GEMMA2/0.9/id-6f15e2ca-531d-4879-b087-f43559d8c3fd",,,,
"/Business/_Sync GEMMA en project/GGM/Bedrijfsobjecten/","Heffingsverordening","business-object","","id-b5f50c54f1cf45b8b7b61a5929035919","{C29CCD49-04E2-44b4-A6B0-AD8B10552628}","Class","06112023-07:59:13","""ggm-"" properties worden beheerd in het GGM informatiemodel","f94b299a-c9eb-4bdb-82e7-5752360494cd","https://redactie.gemmaonline.nl/index.php/GEMMA2/0.9/id-6f15e2ca-531d-4879-b087-f43559d8c3fd",,,,
"/Business/_Sync GEMMA en project/GGM/Bedrijfsobjecten/","Tentoonstelling","business-object","Een uitstalling van voorwerpen om door het grote publiek bekeken te worden.","id-b69273f012f44172b2834bfcc81ca2f1","{069C9894-5E07-4c95-AC28-EB4A5EBFD165}","Class","06112023-07:59:13","""ggm-"" properties worden beheerd in het GGM informatiemodel","7be642b3-e95f-4f1a-9415-d95c38346e9f","https://redactie.gemmaonline.nl/index.php/GEMMA2/0.9/id-6f15e2ca-531d-4879-b087-f43559d8c3fd",,,,
"/Business/_Sync GEMMA en project/GGM/Bedrijfsobjecten/","VTH-Melding","business-object","Melding met betrekking tot Vergunningen, Toezicht en Handhaving","id-b70c4dc91dcb422ab9bff97531419b3e","{E9AEF0A9-11BC-4d2a-BC48-FB77F04EF9A6}","Class","06112023-07:59:13","""ggm-"" properties worden beheerd in het GGM informatiemodel","44f31c7d-6347-4e52-a809-c48563f4b7f1","https://redactie.gemmaonline.nl/index.php/GEMMA2/0.9/id-6f15e2ca-531d-4879-b087-f43559d8c3fd",,,,"Waarneming, Fietsregistratie, Combibon"
"/Business/_Sync GEMMA en project/GGM/Bedrijfsobjecten/","Prijs","business-object","De te betalen hoeveelheid geld","id-b7354ae1907148788a74ebef8bddf0d8","{BF7BAB5F-7025-4792-8288-47F5B1C53E95}","Class","06112023-07:59:13","""ggm-"" properties worden beheerd in het GGM informatiemodel","eab684dd-ef28-42f6-adcc-f9b513859a0d","https://redactie.gemmaonline.nl/index.php/GEMMA2/0.9/id-6f15e2ca-531d-4879-b087-f43559d8c3fd",,,,
"/Business/_Sync GEMMA en project/GGM/Bedrijfsobjecten/","Verzoek","business-object","Een vraag aan het bevoegd gezag om een speficieke product of dienst te leveren.","id-b7c863bc54a540d695e5702fbfc72b43","{B18119D9-5BF8-498f-B9D3-ECCE7A770012}","Class","06112023-07:59:13","""ggm-"" properties worden beheerd in het GGM informatiemodel","6f0e6db2-3ca2-48db-a370-9aacdfcd4c29","https://redactie.gemmaonline.nl/index.php/GEMMA2/0.9/id-6f15e2ca-531d-4879-b087-f43559d8c3fd",,,,
"/Business/_Sync GEMMA en project/GGM/Bedrijfsobjecten/","Mutatie","business-object","Wijziging van een situatie","id-b7d4d0750f0d4ae3a61c47ea4c2e392e","{CB0A6B53-D263-459e-8C28-AD97E5552FFF}","Class","06112023-07:59:13","""ggm-"" properties worden beheerd in het GGM informatiemodel","ab96da46-ed16-412b-8022-4233ce20e311","https://redactie.gemmaonline.nl/index.php/GEMMA2/0.9/id-6f15e2ca-531d-4879-b087-f43559d8c3fd",,,,
"/Business/_Sync GEMMA en project/GGM/Bedrijfsobjecten/","Caseaanmelding","business-object","Verzoek tot toelating","id-b867fe395bf34ba5890c597f912dfc84","{294E3981-C1EF-451e-AE2B-758EC4E4B284}","Class","06112023-07:59:13","""ggm-"" properties worden beheerd in het GGM informatiemodel","4615aabe-451f-40ef-87ce-fb4fcd43c859","https://redactie.gemmaonline.nl/index.php/GEMMA2/0.9/id-6f15e2ca-531d-4879-b087-f43559d8c3fd",,,,
"/Business/_Sync GEMMA en project/GGM/Bedrijfsobjecten/","Subsidie","business-object","Aan derden toegekende financiele middelen, bestemd voor het uitvoeren van bepaalde activiteiten","id-b88fbbb547f940f59dac3ee758ebb811","{FD701A55-6865-44aa-9A73-C46E02481796}","Class","06112023-07:59:13","""ggm-"" properties worden beheerd in het GGM informatiemodel","1fe5c807-e9a7-4f44-a2b6-816341875d6e","https://redactie.gemmaonline.nl/index.php/GEMMA2/0.9/id-6f15e2ca-531d-4879-b087-f43559d8c3fd",,,,
"/Business/_Sync GEMMA en project/GGM/Bedrijfsobjecten/","Eigenaar","business-object","Eigenaar is een persoon die de eigenaar is van een gebouw of stuk grond en ook alle rechten daarvan bezit.","id-b8a3e41e1fa9497980fa7a3f6bf2e7fa","{5E06339C-13EE-44ca-BC40-0FC4B9DC8349}","Class","06112023-07:59:13","""ggm-"" properties worden beheerd in het GGM informatiemodel","06ee795e-36b8-4e13-991d-02a5d91ef015","https://redactie.gemmaonline.nl/index.php/GEMMA2/0.9/id-6f15e2ca-531d-4879-b087-f43559d8c3fd",,,,
"/Business/_Sync GEMMA en project/GGM/Bedrijfsobjecten/","Participatiedossier","business-object","Overzicht van alle informatie over integratie en participatie betreffende een inwoner","id-b8a96aa18aee420b8332f6b7e18780a5","{F1DA83DA-4F56-408c-B2C4-AB6AF02E37B4}","Class","06112023-07:59:13","""ggm-"" properties worden beheerd in het GGM informatiemodel","7524953c-c703-4230-92de-72e04018559a","https://redactie.gemmaonline.nl/index.php/GEMMA2/0.9/id-6f15e2ca-531d-4879-b087-f43559d8c3fd",,,,
"/Business/_Sync GEMMA en project/GGM/Bedrijfsobjecten/","Omgevingsnorm","business-object","Een norm over de fysieke leefomgeving die in een kwantitatieve of kwalitatieve waarde wordt uitgedrukt en geen omgevingswaarde is.","id-baf00a8070f64576be2c97c9b6a959f9","{F90F8E5E-7402-4c44-AC69-91A4175E5D47}","Class","06112023-07:59:13","""ggm-"" properties worden beheerd in het GGM informatiemodel","bbf6bcce-f2dc-4b8d-95a8-561abd7c1d76","https://redactie.gemmaonline.nl/index.php/GEMMA2/0.9/id-6f15e2ca-531d-4879-b087-f43559d8c3fd",,,,
"/Business/_Sync GEMMA en project/GGM/Bedrijfsobjecten/","Subsidiebeschikking","business-object","Besluit over het al dan niet toekennen van een subsidie","id-bb82faf1c0c84edeb3c51401c9318088","{F8BD6D83-D3F8-4dd3-B12E-22A991D1A0A2}","Class","06112023-07:59:13","""ggm-"" properties worden beheerd in het GGM informatiemodel","0cbc6488-2932-4634-b226-a741ba030a46","https://redactie.gemmaonline.nl/index.php/GEMMA2/0.9/id-6f15e2ca-531d-4879-b087-f43559d8c3fd",,,,
"/Business/_Sync GEMMA en project/GGM/Bedrijfsobjecten/","Afspraakstatus","business-object","","id-bc08b22341f547c4b33a89c5a402caa0","{5AA9821A-A88A-480b-9950-70FE017593B3}","Class","06112023-07:59:13","""ggm-"" properties worden beheerd in het GGM informatiemodel","93731fcf-2b7f-42f2-9f94-6f6f80ce0067","https://redactie.gemmaonline.nl/index.php/GEMMA2/0.9/id-6f15e2ca-531d-4879-b087-f43559d8c3fd",,,,
"/Business/_Sync GEMMA en project/GGM/Bedrijfsobjecten/","Sollicitant","business-object","Persoon die werk zoekt","id-bee822c52030465899bf2224e0bcbd3e","{131BDD67-2A31-43c5-9125-F12DE2D98D2D}","Class","06112023-07:59:13","""ggm-"" properties worden beheerd in het GGM informatiemodel","ddefe4a6-d89c-432d-b27a-b96cb575b16a","https://redactie.gemmaonline.nl/index.php/GEMMA2/0.9/id-6f15e2ca-531d-4879-b087-f43559d8c3fd",,,,
